"HGNC symbol","Aliases","Common name","Description","Cytogenetic Location","OMIM","Ensembl","UniProt/Swiss-Prot","Entrez Gene","UniGene"
"DZIP3","UURF2; PPP1R66; hRUL138","DAZ interacting zinc finger protein 3","","3q13.13","608672","ENSG00000198919","DZIP3_HUMAN","9666","409210"
"EBF3","COE3; OE-2; EBF-3; HADDS; O/E-2","early B-cell factor 3","This gene encodes a member of the early B-cell factor (EBF) family of DNA binding transcription factors. EBF proteins are involved in B-cell differentiation, bone development and neurogenesis, and may also function as tumor suppressors. The encoded protein inhibits cell survival through the regulation of genes involved in cell cycle arrest and apoptosis, and aberrant methylation or deletion of this gene may play a role in multiple malignancies including glioblastoma multiforme and gastric carcinoma. [provided by RefSeq, Sep 2011]","10q26.3","607407","ENSG00000108001","COE3_HUMAN","253738","591374"
"EEF1AKMT3","FAM119B; METTL21B","EEF1A lysine methyltransferase 3","","12q14.1","615258","ENSG00000123427","MT21B_HUMAN","25895","632720"
"EGF","URG; HOMG4","epidermal growth factor","This gene encodes a member of the epidermal growth factor superfamily. The encoded preproprotein is proteolytically processed to generate the 53-amino acid epidermal growth factor peptide. This protein acts a potent mitogenic factor that plays an important role in the growth, proliferation and differentiation of numerous cell types. This protein acts by binding with high affinity to the cell surface receptor, epidermal growth factor receptor. Defects in this gene are the cause of hypomagnesemia type 4. Dysregulation of this gene has been associated with the growth and progression of certain cancers. Alternative splicing results in multiple transcript variants, at least one of which encodes a preproprotein that is proteolytically processed. [provided by RefSeq, Jan 2016]","4q25","131530","ENSG00000138798","EGF_HUMAN","1950","419815"
"EGFR","ERBB; HER1; mENA; ERBB1; PIG61; NISBD2","epidermal growth factor receptor","The protein encoded by this gene is a transmembrane glycoprotein that is a member of the protein kinase superfamily. This protein is a receptor for members of the epidermal growth factor family. EGFR is a cell surface protein that binds to epidermal growth factor. Binding of the protein to a ligand induces receptor dimerization and tyrosine autophosphorylation and leads to cell proliferation. Mutations in this gene are associated with lung cancer. [provided by RefSeq, Jun 2016]","7p11.2","131550","ENSG00000146648","B7Z2I3_HUMAN","1956","488293"
"EIF4B","EIF-4B; PRO1843","eukaryotic translation initiation factor 4B","","12q13.13","603928","ENSG00000063046","B4DRM3_HUMAN","1975","648394"
"EIF4E","CBP; EIF4F; AUTS19; EIF4E1; eIF-4E; EIF4EL1","eukaryotic translation initiation factor 4E","The protein encoded by this gene is a component of the eukaryotic translation initiation factor 4F complex, which recognizes the 7-methylguanosine cap structure at the 5' end of messenger RNAs. The encoded protein aids in translation initiation by recruiting ribosomes to the 5'-cap structure. Association of this protein with the 4F complex is the rate-limiting step in translation initiation. This gene acts as a proto-oncogene, and its expression and activation is associated with transformation and tumorigenesis. Several pseudogenes of this gene are found on other chromosomes. Alternative splicing results in multiple transcript variants. [provided by RefSeq, Sep 2015]","4q23","133440","ENSG00000151247","D6RBW1_HUMAN","1977","13211"
"EIF4E3","eIF-4E3; eIF4E-3","eukaryotic translation initiation factor 4E family member 3","EIF4E3 belongs to the EIF4E family of translational initiation factors that interact with the 5-prime cap structure of mRNA and recruit mRNA to the ribosome (Joshi et al., 2004 [PubMed 15153109]).[supplied by OMIM, Mar 2008]","3p13","609896","ENSG00000163412","IF4E3_HUMAN","317649","581355"
"EIF4EBP1","BP-1; 4EBP1; 4E-BP1; PHAS-I","eukaryotic translation initiation factor 4E binding protein 1","This gene encodes one member of a family of translation repressor proteins. The protein directly interacts with eukaryotic translation initiation factor 4E (eIF4E), which is a limiting component of the multisubunit complex that recruits 40S ribosomal subunits to the 5' end of mRNAs. Interaction of this protein with eIF4E inhibits complex assembly and represses translation. This protein is phosphorylated in response to various signals including UV irradiation and insulin signaling, resulting in its dissociation from eIF4E and activation of mRNA translation. [provided by RefSeq, Jul 2008]","8p11.23","602223","ENSG00000187840","4EBP1_HUMAN","1978","411641"
"ENOX1","CNOX; PIG38; cCNOX; bA64J21.1","ecto-NOX disulfide-thiol exchanger 1","The protein encoded by this gene is involved in plasma membrane electron transport pathways. The encoded protein has both a hydroquinone (NADH) oxidase activity and a protein disulfide-thiol interchange activity. The two activities cycle with a periodicity of 24 minutes, with one activity being at its peak when the other is at its lowest. [provided by RefSeq, Dec 2016]","13q14.11","610914","ENSG00000120658","A0A024RDT8_HUMAN","55068","128258"
"EPB41L4B","CG1; EHM2","erythrocyte membrane protein band 4.1 like 4B","","9q31.3","610340","ENSG00000095203","E41LB_HUMAN","54566","591901"
"EPHA1-AS1","","EPHA1 antisense RNA 1","","7q35","","ENSG00000229153","","285965","642649"
"EQTN","AFAF; SPACA8; C9orf11","equatorin","","9p21.2","","ENSG00000120160","EQTN_HUMAN","54586","163070"
"ERBB2","NEU; NGL; HER2; TKR1; CD340; HER-2; MLN; 19; HER-2/neu","erb-b2 receptor tyrosine kinase 2","This gene encodes a member of the epidermal growth factor (EGF) receptor family of receptor tyrosine kinases. This protein has no ligand binding domain of its own and therefore cannot bind growth factors. However, it does bind tightly to other ligand-bound EGF receptor family members to form a heterodimer, stabilizing ligand binding and enhancing kinase-mediated activation of downstream signalling pathways, such as those involving mitogen-activated protein kinase and phosphatidylinositol-3 kinase. Allelic variations at amino acid positions 654 and 655 of isoform a (positions 624 and 625 of isoform b) have been reported, with the most common allele, Ile654/Ile655, shown here. Amplification and/or overexpression of this gene has been reported in numerous cancers, including breast and ovarian tumors. Alternative splicing results in several additional transcript variants, some encoding different isoforms and others that have not been fully characterized. [provided by RefSeq, Jul 2008]","17q12","164870","ENSG00000141736","ERBB2_HUMAN","2064","446352"
"ERBB4","HER4; ALS19; p180erbB4","erb-b2 receptor tyrosine kinase 4","This gene is a member of the Tyr protein kinase family and the epidermal growth factor receptor subfamily. It encodes a single-pass type I membrane protein with multiple cysteine rich domains, a transmembrane domain, a tyrosine kinase domain, a phosphotidylinositol-3 kinase binding site and a PDZ domain binding motif. The protein binds to and is activated by neuregulins and other factors and induces a variety of cellular responses including mitogenesis and differentiation. Multiple proteolytic events allow for the release of a cytoplasmic fragment and an extracellular fragment. Mutations in this gene have been associated with cancer. Alternatively spliced variants which encode different protein isoforms have been described; however, not all variants have been fully characterized. [provided by RefSeq, Jul 2008]","2q34","600543","ENSG00000178568","ERBB4_HUMAN","2066","390729"
"ERCC1","UV20; COFS4; RAD10","ERCC excision repair 1, endonuclease non-catalytic subunit","The product of this gene functions in the nucleotide excision repair pathway, and is required for the repair of DNA lesions such as those induced by UV light or formed by electrophilic compounds including cisplatin. The encoded protein forms a heterodimer with the XPF endonuclease (also known as ERCC4), and the heterodimeric endonuclease catalyzes the 5' incision in the process of excising the DNA lesion. The heterodimeric endonuclease is also involved in recombinational DNA repair and in the repair of inter-strand crosslinks. Mutations in this gene result in cerebrooculofacioskeletal syndrome, and polymorphisms that alter expression of this gene may play a role in carcinogenesis. Multiple transcript variants encoding different isoforms have been found for this gene. The last exon of this gene overlaps with the CD3e molecule, epsilon associated protein gene on the opposite strand. [provided by RefSeq, Oct 2009]","19q13.32","126380","ENSG00000012061","A0A024R0Q6_HUMAN","2067","435981"
"ERCC2","EM9; TTD; XPD; TTD1; COFS2; TFIIH","ERCC excision repair 2, TFIIH core complex helicase subunit","The nucleotide excision repair pathway is a mechanism to repair damage to DNA. The protein encoded by this gene is involved in transcription-coupled nucleotide excision repair and is an integral member of the basal transcription factor BTF2/TFIIH complex. The gene product has ATP-dependent DNA helicase activity and belongs to the RAD3/XPD subfamily of helicases. Defects in this gene can result in three different disorders, the cancer-prone syndrome xeroderma pigmentosum complementation group D, trichothiodystrophy, and Cockayne syndrome. Alternatively spliced transcript variants encoding different isoforms have been found for this gene. [provided by RefSeq, Aug 2008]","19q13.32","126340","ENSG00000104884","ERCC2_HUMAN","2068","487294"
"ERCC3","XPB; BTF2; TTD2; GTF2H; RAD25; TFIIH","ERCC excision repair 3, TFIIH core complex helicase subunit","This gene encodes an ATP-dependent DNA helicase that functions in nucleotide excision repair. The encoded protein is a subunit of basal transcription factor 2 (TFIIH) and, therefore, also functions in class II transcription. Mutations in this gene are associated with Xeroderma pigmentosum B, Cockayne's syndrome, and trichothiodystrophy. Alternative splicing results in multiple transcript variants. [provided by RefSeq, Dec 2014]","2q14.3","133510","ENSG00000163161","B3KRG2_HUMAN","2071","469872"
"ERCC4","XPF; RAD1; FANCQ; XFEPS; ERCC11","ERCC excision repair 4, endonuclease catalytic subunit","The protein encoded by this gene forms a complex with ERCC1 and is involved in the 5' incision made during nucleotide excision repair. This complex is a structure specific DNA repair endonuclease that interacts with EME1. Defects in this gene are a cause of xeroderma pigmentosum complementation group F (XP-F), or xeroderma pigmentosum VI (XP6).[provided by RefSeq, Mar 2009]","16p13.12","133520","ENSG00000175595","B4DXD8_HUMAN","2072","567265"
"ERCC5","XPG; UVDR; XPGC; COFS3; ERCM2; ERCC5-201","ERCC excision repair 5, endonuclease","This gene encodes a single-strand specific DNA endonuclease that makes the 3' incision in DNA excision repair following UV-induced damage. The protein may also function in other cellular processes, including RNA polymerase II transcription, and transcription-coupled DNA repair. Mutations in this gene cause xeroderma pigmentosum complementation group G (XP-G), which is also referred to as xeroderma pigmentosum VII (XP7), a skin disorder characterized by hypersensitivity to UV light and increased susceptibility for skin cancer development following UV exposure. Some patients also develop Cockayne syndrome, which is characterized by severe growth defects, mental retardation, and cachexia. Read-through transcription exists between this gene and the neighboring upstream BIVM (basic, immunoglobulin-like variable motif containing) gene. [provided by RefSeq, Feb 2011]","13q33.1","133530","ENSG00000134899","ERCC5_HUMAN","2073","258429"
"ERCC6","CSB; CKN2; COFS; ARMD5; COFS1; POF11; RAD26; UVSS1","ERCC excision repair 6, chromatin remodeling factor","This gene encodes a DNA-binding protein that is important in transcription-coupled excision repair. The encoded protein has ATP-stimulated ATPase activity, interacts with several transcription and excision repair proteins, and may promote complex formation at DNA repair sites. Mutations in this gene are associated with Cockayne syndrome type B and cerebrooculofacioskeletal syndrome 1. Alternative splicing occurs between a splice site from exon 5 of this gene to the 3' splice site upstream of the open reading frame (ORF) of the adjacent gene, piggyback-derived-3 (GeneID:267004), which activates the alternative polyadenylation site downstream of the piggyback-derived-3 ORF. The resulting transcripts encode a fusion protein that shares sequence with the product of each individual gene. [provided by RefSeq, Mar 2016]","10q11.23","609413","ENSG00000225830","A8K4Q3_HUMAN","2074","49063"
"ERCC8","CSA; CKN1; UVSS2","ERCC excision repair 8, CSA ubiquitin ligase complex subunit","This gene encodes a WD repeat protein, which interacts with Cockayne syndrome type B (CSB) protein and with p44 protein, a subunit of the RNA polymerase II transcription factor IIH. Mutations in this gene have been identified in patients with hereditary disease Cockayne syndrome (CS). CS cells are abnormally sensitive to ultraviolet radiation and are defective in the repair of transcriptionally active genes. Several transcript variants encoding different isoforms have been found for this gene. [provided by RefSeq, Mar 2014]","5q12.1","609412","ENSG00000049167","A0A0S2Z3L1_HUMAN","1161","435237"
"ERGIC1","NET24; ERGIC32; ERGIC-32","endoplasmic reticulum-golgi intermediate compartment 1","This gene encodes a cycling membrane protein which is an endoplasmic reticulum-golgi intermediate compartment (ERGIC) protein which interacts with other members of this protein family to increase their turnover. [provided by RefSeq, Jul 2008]","5q35.1","","ENSG00000113719","ERGI1_HUMAN","57222","509163"
"ERICH5","C8orf47","glutamate rich 5","","8q22.2","","ENSG00000177459","ERIC5_HUMAN","203111","171455"
"ESR1","ER; ESR; Era; ESRA; ESTRR; NR3A1","estrogen receptor 1","This gene encodes an estrogen receptor, a ligand-activated transcription factor composed of several domains important for hormone binding, DNA binding, and activation of transcription. The protein localizes to the nucleus where it may form a homodimer or a heterodimer with estrogen receptor 2. Estrogen and its receptors are essential for sexual development and reproductive function, but also play a role in other tissues such as bone. Estrogen receptors are also involved in pathological processes including breast cancer, endometrial cancer, and osteoporosis. Alternative promoter usage and alternative splicing result in dozens of transcript variants, but the full-length nature of many of these variants has not been determined. [provided by RefSeq, Mar 2014]","6q25.1-q25.2","133430","ENSG00000091831","A0A125SXW3_HUMAN","2099","208124"
"ESRRG","ERR3; NR3B3; ERRgamma","estrogen related receptor gamma","This gene encodes a member of the estrogen receptor-related receptor (ESRR) family, which belongs to the nuclear hormone receptor superfamily. All members of the ESRR family share an almost identical DNA binding domain, which is composed of two C4-type zinc finger motifs. The ESRR members are orphan nuclear receptors; they bind to the estrogen response element and steroidogenic factor 1 response element, and activate genes controlled by both response elements in the absence of any ligands. The ESRR family is closely related to the estrogen receptor (ER) family. They share target genes, co-regulators and promoters, and by targeting the same set of genes, the ESRRs seem to interfere with the ER-mediated estrogen response in various ways. It has been reported that the family member encoded by this gene functions as a transcriptional activator of DNA cytosine-5-methyltransferases 1 (Dnmt1) expression by direct binding to its response elements in the DNMT1 promoters, modulates cell proliferation and estrogen signaling in breast cancer, and negatively regulates bone morphogenetic protein 2-induced osteoblast differentiation and bone formation. Multiple alternatively spliced transcript variants have been identified, which mainly differ at the 5' end and some of which encode protein isoforms differing in the N-terminal region. [provided by RefSeq, Aug 2011]","1q41","602969","ENSG00000196482","B7Z5E9_HUMAN","2104","444225"
"EXO1","HEX1; hExoI","exonuclease 1","This gene encodes a protein with 5' to 3' exonuclease activity as well as an RNase H activity. It is similar to the Saccharomyces cerevisiae protein Exo1 which interacts with Msh2 and which is involved in mismatch repair and recombination. Alternative splicing of this gene results in three transcript variants encoding two different isoforms. [provided by RefSeq, Jul 2008]","1q43","606063","ENSG00000174371","A8K5H6_HUMAN","9156","498248"
"F2","PT; THPH1; RPRGL2","coagulation factor II, thrombin","Coagulation factor II is proteolytically cleaved to form thrombin in the first step of the coagulation cascade which ultimately results in the stemming of blood loss. F2 also plays a role in maintaining vascular integrity during development and postnatal life. Peptides derived from the C-terminus of this protein have antimicrobial activity against E. coli and P. aeruginosa. Mutations in F2 lead to various forms of thrombosis and dysprothrombinemia. Alternative splicing results in multiple transcript variants. [provided by RefSeq, Aug 2015]","11p11.2","176930","ENSG00000180210","THRB_HUMAN","2147","655207"
"F5","FVL; PCCF; THPH2; RPRGL1","coagulation factor V","This gene encodes an essential cofactor of the blood coagulation cascade. This factor circulates in plasma, and is converted to the active form by the release of the activation peptide by thrombin during coagulation. This generates a heavy chain and a light chain which are held together by calcium ions. The activated protein is a cofactor that participates with activated coagulation factor X to activate prothrombin to thrombin. Defects in this gene result in either an autosomal recessive hemorrhagic diathesis or an autosomal dominant form of thrombophilia, which is known as activated protein C resistance. [provided by RefSeq, Oct 2008]","1q24.2","612309","ENSG00000198734","FA5_HUMAN","2153","30054"
"F7","SPCA","coagulation factor VII","This gene encodes coagulation factor VII which is a vitamin K-dependent factor essential for hemostasis. This factor circulates in the blood in a zymogen form, and is converted to an active form by either factor IXa, factor Xa, factor XIIa, or thrombin by minor proteolysis. Upon activation of the factor VII, a heavy chain containing a catalytic domain and a light chain containing 2 EGF-like domains are generated, and two chains are held together by a disulfide bond. In the presence of factor III and calcium ions, the activated factor then further activates the coagulation cascade by converting factor IX to factor IXa and/or factor X to factor Xa. Defects in this gene can cause coagulopathy. Alternative splicing results in multiple transcript variants encoding different isoforms that may undergo similar proteolytic processing to generate mature polypeptides. [provided by RefSeq, Aug 2015]","13q34","613878","ENSG00000057593","B4DPM2_HUMAN","2155","36989"
"FAM19A1","TAFA1; TAFA-1","family with sequence similarity 19 member A1, C-C motif chemokine like","This gene is a member of the TAFA family which is composed of five highly homologous genes that encode small secreted proteins. These proteins contain conserved cysteine residues at fixed positions, and are distantly related to MIP-1alpha, a member of the CC-chemokine family. The TAFA proteins are predominantly expressed in specific regions of the brain, and are postulated to function as brain-specific chemokines or neurokines that act as regulators of immune and nervous cells. [provided by RefSeq, Jul 2008]","3p14.1","","ENSG00000183662","F19A1_HUMAN","407738","655061"
"FAM19A5","TAFA5; TAFA-5; UNQ5208; QLLK5208","family with sequence similarity 19 member A5, C-C motif chemokine like","This gene is a member of the TAFA family which is composed of five highly homologous genes that encode small secreted proteins. These proteins contain conserved cysteine residues at fixed positions, and are distantly related to MIP-1alpha, a member of the CC-chemokine family. The TAFA proteins are predominantly expressed in specific regions of the brain, and are postulated to function as brain-specific chemokines or neurokines that act as regulators of immune and nervous cells. [provided by RefSeq, Sep 2013]","22q13.32","","ENSG00000219438","F19A5_HUMAN","25817","436854"
"FAM49B","L1; BM-009","family with sequence similarity 49 member B","","8q24.21","","ENSG00000153310","A0A024R9G4_HUMAN","51571","126941"
"FAM98B","","family with sequence similarity 98 member B","","15q14","616142","ENSG00000171262","FA98B_HUMAN","283742","6799"
"FANCA","FA; FA1; FAA; FAH; FA-H; FACA; FANCH","Fanconi anemia complementation group A","The Fanconi anemia complementation group (FANC) currently includes FANCA, FANCB, FANCC, FANCD1 (also called BRCA2), FANCD2, FANCE, FANCF, FANCG, FANCI, FANCJ (also called BRIP1), FANCL, FANCM and FANCN (also called PALB2). The previously defined group FANCH is the same as FANCA. Fanconi anemia is a genetically heterogeneous recessive disorder characterized by cytogenetic instability, hypersensitivity to DNA crosslinking agents, increased chromosomal breakage, and defective DNA repair. The members of the Fanconi anemia complementation group do not share sequence similarity; they are related by their assembly into a common nuclear protein complex. This gene encodes the protein for complementation group A. Alternative splicing results in multiple transcript variants encoding different isoforms. Mutations in this gene are the most common cause of Fanconi anemia. [provided by RefSeq, Jul 2008]","16q24.3","607139","ENSG00000187741","FANCA_HUMAN","2175","744083"
"FANCD2","FA4; FAD; FACD; FAD2; FA-D2; FANCD","Fanconi anemia complementation group D2","The Fanconi anemia complementation group (FANC) currently includes FANCA, FANCB, FANCC, FANCD1 (also called BRCA2), FANCD2, FANCE, FANCF, FANCG, FANCI, FANCJ (also called BRIP1), FANCL, FANCM and FANCN (also called PALB2). The previously defined group FANCH is the same as FANCA. Fanconi anemia is a genetically heterogeneous recessive disorder characterized by cytogenetic instability, hypersensitivity to DNA crosslinking agents, increased chromosomal breakage, and defective DNA repair. The members of the Fanconi anemia complementation group do not share sequence similarity; they are related by their assembly into a common nuclear protein complex. This gene encodes the protein for complementation group D2. This protein is monoubiquinated in response to DNA damage, resulting in its localization to nuclear foci with other proteins (BRCA1 AND BRCA2) involved in homology-directed DNA repair. Alternative splicing results in multiple transcript variants. [provided by RefSeq, Feb 2016]","3p25.3","613984","ENSG00000144554","A0A024R2G2_HUMAN","2177","208388"
"FANCI","KIAA1794","Fanconi anemia complementation group I","The Fanconi anemia complementation group (FANC) currently includes FANCA, FANCB, FANCC, FANCD1 (also called BRCA2), FANCD2, FANCE, FANCF, FANCG, FANCI, FANCJ (also called BRIP1), FANCL, FANCM and FANCN (also called PALB2). The previously defined group FANCH is the same as FANCA. Fanconi anemia is a genetically heterogeneous recessive disorder characterized by cytogenetic instability, hypersensitivity to DNA crosslinking agents, increased chromosomal breakage, and defective DNA repair. The members of the Fanconi anemia complementation group do not share sequence similarity; they are related by their assembly into a common nuclear protein complex. This gene encodes the protein for complementation group I. Alternative splicing results in two transcript variants encoding different isoforms. [provided by RefSeq, Jul 2008]","15q26.1","611360","ENSG00000140525","B3KNW8_HUMAN","55215","513126"
"FARP1","CDEP; PLEKHC2; PPP1R75; FARP1-IT1","FERM, ARH/RhoGEF and pleckstrin domain protein 1","This gene encodes a protein containing a FERM (4.2, exrin, radixin, moesin) domain, a Dbl homology domain, and two pleckstrin homology domains. These domains are found in guanine nucleotide exchange factors and proteins that link the cytoskeleton to the cell membrane. The encoded protein functions in neurons to promote dendritic growth. Alternative splicing results in multiple transcript variants. [provided by RefSeq, Nov 2013]","13q32.2","602654","ENSG00000152767","C9JME2_HUMAN","10160","403917"
