id,Association,Population,Variant(s),Gene(s),PubMed,Study Design,Conclusions
G403,non-significant,Finnish and Mexican,"L1074F,C1367R",WRN,11186893,Population studies of the 1074Leu/Phe and 1367Cys/Arg polymorphisms were undertaken to evaluate the role of WRN in atherogenesis,"Frequencies of the 1074Leu/Phe polymorphisms revealed an age-dependent decline of 1074Phe/Phe genotype. There was a tendency for the 1074Phe allele to be associated with coronary stenosis in a gene dose-dependent manner. The 1367Arg/Arg genotype predicted a lower degree of coronary artery occlusion, when compared to the 1367Cys/Cys or 1367Cys/Arg genotypes. However, these tendencies did not achieve statistical significance."
G404,significant,Danish,"R/Q353,FVII-323ins10",F7,11602206,Blood coagulation factor VII (FVII) R/Q353 and FVII-323ins10 SNPs were examined in 187 centenarians (47 males and 140 females) and 201 controls (20-64 years),"R/Q353 and FVII-323ins10 manifest significant influences on survival in males, with reduced hazards of death for carriers of the Q353 allele and the FVII-323P10 allele"
G405,significant,"Czechs (Bohemian), Americans (Baltimore Caucasians and African-Americans)","F352V,C370S",KL,11792841,"Amino acid substitutions F352V and C370S SNPs were examined in 435 elderly individuals (>75 years) and 611 contemporary newborns (Bohemian Czech), 965 elderly individuals (>65 years) and 646 control infants (Baltimore Caucasians and Baltimore African-Americans)",Homozygous elderly individuals were underrepresented in all populations
G406,non-significant,Italian (Sardinia),"C282Y,H63D,S65C",HFE,12714263,"The C282Y, H63D and S65C SNPs were examined in 61 controls and 57 centenarians","Although there was a trend for an increased frequency of the H63D allele in centenarian women, no significant differences were observed in frequencies of the different alleles between young and centenarians"
G407,significant,Italian,"G/A,codon 1013",IGF1R,12843179,"The G/A, codon 1013 polymorphism was examined in healthy people 17-85 yr of age (n= 278; mean age, 54.8; 76 males and 202 females) and in healthy people 86-109 yr of age (n= 218; mean age, 98.0; 56 males and 162 females)",The analysis revealed lower free IGF-I plasma levels in IGF1R A subjects (AG and AA genotypes) than in A- (GG genotype) subjects. A subjects were more represented among long-lived people than in young people.
G408,non-significant,Bulgarian,"DQB105,DQB103",HLA-DQB1,15050300,"5 alleles were examined in 17 unrelated elderly (age 65-90 years; 6 males and 11 females), 23 family members (age 18-57 years; 9 males and 14 females, and a control group with 105 randomly selected, matched for geographical distribution healthy controls aged 25-53 years (40 male and 65 female)","The most frequent DQB1 alleles in elderly Bulgarians were DQB103 and DQB105, though differences were not statistically significant after correcting for multiple testing"
G409,non-significant,Bulgarian,"DRB111,DRB113",HLA-DRB1,15050300,"10 alleles were examined in 17 unrelated elderly (age 65-90 years; 6 males and 11 females), 23 family members (age 18-57 years; 9 males and 14 females), and a control group with 105 randomly selected, matched for geographical distribution healthy controls aged 25-53 years (40 male and 65 female)","The most frequent HLADRB1 alleles in elderly Bulgarians were DRB111 and DRB113. The most frequent haplotypes in elderly Bulgarians compared to the controls were DRB111-DQB103 and DRB113-DQB106, though this was not statistically significant after correcting for multiple testing."
G411,non-significant,German,"T461N,3801T/ C",CYP1A1,15177664,T461N and 3801 T/ C SNPs were examined in 205 octogenarians and a reference group of 294 persons aged less than 80 years,No association with longevity was found
G412,significant,Italian (Northern),"TP53,GSTT1","TP53,GSTT1",15195682,GSTT1 (Glutathione S-transferase theta 1) deletion and the simultaneous presence of the three p53 polymorphisms were examined in 66 nonagenarians and centenarians in good health and in a sample of 150 young healthy volunteers of the same ethnic group,"No significant differences were found for individual genes. However, the absence of any p53 polymorphisms and of GSTT1 deletion, and the simultaneous presence of the three p53 polymorphisms and of GSTT1 deletion, were much more frequent in young subjects than in centenarians (41.5% versus 26.9% and 8.8% versus 3.8%, respectively)."
G413,significant,Italian,"-800G/A,-509C/T,869T/C,915G/C",TGFB1,15569360,"4 SNPs (-800 G/A, -509 C/T, +869 T/C and +915 G/C) were analysed in 419 subjects from Northern and Central Italy, including 172 centenarians and 247 younger controls","Significant differences were found at the +915 site as far as the C allele and GC genotype were concerned, both of them being lower in centenarians than in young controls, but none of the other tested genetic variants was significantly different between centenarians and controls. Moreover, a particular haplotype combination (G -800/C -509/C 869/C 915) was notably lower in centenarians than in younger individuals."
G416,non-significant,Dutch,"i1-C/T,L1074F,C1367R",WRN,16405962,"The i1-C/T, L1074F and C1367R polymorphisms were examined in 1245 participants aged 85 years and older",The polymorphisms were not found to influence aging-trajectories or survival
G417,significant,Korean,"C670,A676,T1172",MLH1,16474933,3 SNPs in the coding region were analyzed in 85 Korean centenarians and in 106 Korean controls,"The CAT haplotype (C670, A676 and T1172) frequency was significantly higher in the centenarians than in the controls"
G418,non-significant,English,"R194W,R399Q",XRCC1,16518718,"R194W, R399Q and a [AC]n microsatellite in the 3' UTR polymorphisms were examined in a cohort of newborns (n=290) and a retired population (average age at sampling 70.02 years; n=430)",No evidence of association with longevity was found
G419,non-significant,Dutch,"-493G/T,Q95H",MTTP,16611701,"-493G/T and Q95H allele and haplotype frequencies were examined in 379 nonagenarians, 525 of their offspring, and 251 partners of their offspring and in 655 octogenarians and 244 young controls",No association with longevity was found
G420,non-significant,Dutch,"ER22/23EK,N363S,BclI",NR3C1,16676134,"552 participants aged 85 years and over were genotyped for the ER22/23EK, N363S and BclI polymorphisms","No associations with cardiovascular pathologies, all cause and cardiovascular mortality were observed for any of the polymorphisms."
G422,significant,Ashkenazi Jewish,"1545G>A,4103C>T",IGF1R,18316725,"Genetic variation in IGF1 and IGF1R were examined in a cohort of Ashkenazi Jewish centenarians (286 females and 98 males, average age 97.7 years), their offspring (114 females and 174 males, mean age 67.8 years), and offspring-matched controls (n = 312, mean age 79.5 years)",There was an overrepresentation of two nonsynonymous mutations in the IGF1R gene among centenarians relative to controls. These are also associated with high serum IGFI levels and reduced activity of the IGFIR as measured in transformed lymphocytes.
G431,significant,Chinese (Uighur in Xinjiang),"A1267G,G190C,T2437C","HSPA1B,HSPA1A,HSPA1L",19840767,"Case-control study in 191 healthy individuals greater than 90 years of age, and 53 naturally died persons 65-70 years of age on A1267G in HSPA1B, G190C in HSPA1A, and T2437C in HSPA1L","In single-locus analysis, no significant differences were found between long-lived people and short-lived people in the genotype/allele distributions of all variants. In contrast, haplotype analysis indicated that haplotypes A-G-C and A-C-T were more prevalent in long-lived people than short-lived people (P=0.026 and 0.017), and the analysis conferred a 3.46- and 4.51-fold increased tendency for longevity, respectively (P=0.025 and 0.016)."
G436,significant,Danish,"1267A>G,2437T>C,-110A>C","HSPA1B,HSPA1L,HSPA1A",20388090,"Three single nucleotide polymorphisms, HSPA1A (-110A>C), HSPA1B (1267A>G), and HSPA1L (2437T>C), present in the three HSP70 genes, were studied in a cohort of individuals born in the year 1905.","A significant association of HSPA1A-AA (RR=3.864; p=0.016) and HSPA1B-AA (RR=2.764; p=0.039) genotypes with poor survival was observed in female subjects. Also the female carriers of haplotype G-C-T had longer survival than the non-carriers (HRR=0.550; p=0.015). On an average, female carriers of the G-C-T haplotype live about one year longer than non-carriers."
G438,significant,American (Georgia and Louisiana populations from African and European origin),"APOE,HRAS,CERS1","APOE,HRAS,CERS1",20569235,"Haplotype analysis was performed in three candidate genes, and the haplotype combinations were tested for association with exceptional longevity in the Georgia Centenarian Study (n=650) and Louisiana Healthy Aging Study (n=869)","An HRAS1 haplotype enhanced the effect of an APOE haplotype on exceptional survival, and a LASS1 haplotype further augmented its magnitude. These results were replicated in a second population."
G446,non-significant,Ashkenazi Jewish,"p.Y318C,p.V465A","PMS2,GABRR3",23376243,"Next-generation sequencing was employed to identify novel variants in 988 candidate genes in 6 centenarians, revealing 89 novel non-synonymous SNPs. These were genotyped in 410 Ashkenazi Jewish controls and 390 centenarians.","Without correcting for multiple testing, the p.Y318C variant in PMS2 was significantly enriched while the p.V465A variant in GABRR3 was significantly depleted in centenarians"
G452,non-significant,German,"FOXO3,EXO1","FOXO3,EXO1",21740922,"Genome-wide association study comparing 664,472 autosomal SNPs in 763 long-lived individuals (mean age: 99.7 years) and 1085 controls (mean age: 60.2 years). Top SNPs from the GWAS were further investigated in an independent German sample comprised of 754 long-lived individuals (mean age: 96.9 years) and 860 controls (mean age: 67.3 years).",FOXO3A and EXO1 were not significantly associated with longevity
G457,significant,Dutch,"AKT1,AKT3,FOXO4,IGF2,INS,PIK3CA,SGK1,SGK3,YWHAG,POT1","AKT1,AKT3,FOXO4,IGF2,INS,PIK3CA,SGK1,SGK3,YWHAG,POT1",22113349,"Studied genetic variation in the insulin/insulin-like growth factor signaling (IIS) pathway and in the telomere maintenance pathway for associations with longevity in 403 unrelated nonagenarians and 1,670 younger controls","SNP sets in both pathways were associated with longevity with the association of the IIS pathway defined by several genes (AKT1, AKT3, FOXO4, IGF2, INS, PIK3CA, SGK, SGK2, and YWHAG), while the telomere maintenance pathway seemed to be mainly determined by POT1 since only these genes showed an association with longevity"
G461,significant,Dutch,"RHEB,RHOA,RICTOR,RPS6,RPS6KB1,SGK1,POLDIP3,SREBF1,TSC1,TSC2,ULK1,YY1,EIF4EBP1,AKT1,C12orf44,ATG13,DEPTOR,EIF4B,EIF4E,RB1CC1,FOXO1,FOXO3,HIF1A,MLST8,LAMTOR3,MAPKAP1,MTOR,LAMTOR2,CDKN2C,PPARGC1A,PRKCA,PPARG,AKT1S1,PRR5,PRR5L,RRAGA,RRAGB,RRAGC,RRAGD,RPTOR","RHEB,RHOA,RICTOR,RPS6,RPS6KB1,SGK1,POLDIP3,SREBF1,TSC1,TSC2,ULK1,YY1,EIF4EBP1,AKT1,ATG101,ATG13,DEPTOR,EIF4B,EIF4E,RB1CC1,FOXO1,FOXO3,HIF1A,MLST8,LAMTOR3,MAPKAP1,MTOR,LAMTOR2,CDKN2C,PPARGC1A,PRKCA,PPARG,AKT1S1,PRR5,PRR5L,RRAGA,RRAGB,RRAGC,RRAGD,RPTOR",23061800,"1,018 SNPs within a 10-kb window around 40 mTOR signalling genes were studied for differences in variation between 417 unrelated nonagenarian participants and 476 younger controls","As a whole, there was a significant association of genetic variation in the mTOR pathway and familial longevity, though no individual gene was significant after correcting for multiple hypothesis testing"
G465,non-significant,European,"TH,IGF2,INS,HRAS","TH,IGF2,INS,HRAS",19367319,The chromosomal region 11p.15.5 was investigated in 1321 centenarians and 1140 younger subjects from European samples,"No significant results were observed for genes previously associated with longevity: TH, IGF2, INS and HRAS1"
G487,significant,Chinese (Guangxi Bama),"mt146T,mt146C",,22729909,"The mtDNA of ten bama centenarians were sequenced and  seven novel variations were identified. 313 individuals(113 samples in the 90-110 y, 75 between 80-89 y and 125 between 10-79 y) were involved for the analysis of 26 variations in mtDNA D-loop and several serum parameters.","mt146 was associated with longevity. The mt146T had a significantly lower frequency while mt146C occurred at a significantly higher frequency in the 90–110 years old group than that in the two younger (the 80–89 and 10–79 years old) groups (P < 0.005). In the 90-110 y cohort, the levels of systolic blood pressure, the total cholesterol and low density lipoprotein were significantly higher in the mt146C carriers than in the mt146T carriers (P < 0.05), as well as the levels of triglyceride(P < 0.01). No significant differences were found in these parameters between the two younger age groups."
G499,significant,Italian (Southern),"A-3826G,C-3740A",UCP1,21827845,"Two polymorphisms (A-3826G and C-3740A), falling in the upstream promoter region of UCP1, were analyzed in a sample of 910 unrelated subjects from southern Italy (475 women and 435 men; age range 40–109)","Haplotype specific survival functions show that the A-C haplotype favors survival in the elderly. The results indicate that the A-C haplotype has a recessive and beneficial effect, while the G-A haplotype has a dominant and deleterious effect on human aging and longevity."
G520,non-significant,Italian (Sicily),"H63D,S65C",HFE,11857056,"C282Y, H63D and S65C polymorphisms were studied in 106 young controls (22 - 55 years; 40 men) and 35 elderly subjects (91 - 105 years; 7 men)","Concerning H63D polymorphisms, no significant differences were observed, between old and young people. S65C was not detected."
G522,significant,Irish,"16389g,16000g",TP53,11404057,"Polymorphic restriction enzyme sites within a 2643 bp region of mtDNA were identified by PCR-RFLP in 129 aged individuals (80- 97y, 70% female) and 100 controls (19- 45y, 59% female). Then, genetic haplotypes for a healthy aged and a younger control cohort of patients was constructed to find out the relationship between longevity and mtDNA polymorphisms.","The were no significant frequency differences between the two age groups for 46 identified haplotypes. However, the branch of haplotypes defined by 16389g displayed a significant increased frequency in the aged samples (P=0.015). Inversely, the branch of haplotypes defined by 16000g displayed a significant decreased frequency in the aged samples (P=0.011)."
G523,Non-significant,Irish,"mt9055A,mt5178A",TP53,11404057,"Polymorphic restriction enzyme sites within a 2643 bp region of mtDNA were identified by PCR-RFLP in 129 aged individuals (80- 97y, 70% female) and 100 controls (19- 45y, 59% female). Then, genetic haplotypes for a healthy aged and a younger control cohort of patients was constructed to find out the relationship between longevity and mtDNA polymorphisms.","The were no significant frequency differences between the two age groups for 46 identified haplotypes. The previously reported longevity associated  European J haplogroup was not found at an increased frequency within the Irish aged population (P=0.36). The polymorphism (mt5178A) associated with longevity in the Japanese was not found in the Irish population, while the polymorphism (mt9055A) associated with successful ageing in French centenarians was found at a noticeable but not significant (P=0.164) increased frequency in the Irish aged population compared to the younger control group."
G535,non-significant,Spanish,"E2,E3","DBT,DLD",24534555,"Three most common alleles of the APOE gene were examined in three cohorts (Spanish, Italian and Japanese) to study their association with longevity.","E4 allele was negatively associated with longevity in three cohorts, while the E2 allele was positively associated in Italian and Japanese cohorts."
G536,significant,Italian,"E2,E3,E4","DBT,DLD,UBE4B",24534555,"Three most common alleles of the APOE gene were examined in three cohorts (Spanish, Italian and Japanese) to study their association with longevity.","E4 allele was negatively associated with longevity in three cohorts, while the E2 allele was positively associated in Italian and Japanese cohorts."
G537,significant,Japanese,"E2,E3,E4","DBT,DLD,UBE4B",24534555,"Three most common alleles of the APOE gene were examined in three cohorts (Spanish, Italian and Japanese) to study their association with longevity.","E4 allele was negatively associated with longevity in three cohorts, while the E2 allele was positively associated in Italian and Japanese cohorts."
551,significant,Italian,Hinf347,APOA4,9622284,"After 16 SNPs over LMNA gene were genotyped in 873 long-lived individuals and 443 controls for association with longevity, a haplotype was identified. Then, the result was tested in 3619 subjects from four independent samples (738 New England Centenarian Study samples, 905 Southern Italian Centenarian Study samples, 1103 France samples and 702 Einstein Ashkenazi Longevity Study).","A meta-analysis combining results from 5 sets of samples showed the haplotype based on 4 SNPs (rs915179, rs2485662, rs4641, rs1468772) from LMNA was significantly associated with longevity. Other SNPs were not associated with longevity."
G554,non-significant,American (Georgia and Louisiana populations from African and European origin),"CERS1,HRAS","CERS1,HRAS",20569235,"Subjects were recruited and stratified according to their genetically inferred ethnic affiliation to account for population structure. Haplotype analysis was performed in three candidate genes, and the haplotype combinations were tested for association with exceptional longevity.",LASS1 and HRAS1 were not individually associated with longevity
555,significant,Chinese,E4,UBE4B,24746514,"Meta-analysis of GWAS in Caucasians from four prospective cohort studies: the Age, Gene/Environment Susceptibility-Reykjavik Study, the Cardiovascular Health Study, the Framingham Heart Study, and the Rotterdam Study participating in the Cohorts for Heart and Aging Research in Genomic Epidemiology (CHARGE) Consortium. Longevity was defined as survival to age 90 years or older (n = 1,836); the comparison group comprised cohort members who died between the ages of 55 and 80 years (n = 1,955).","There were 273 single-nucleotide polymorphism (SNP) associations with p < .0001, but none reached significance after correcting for multiple testing"
258,significant,American (Caucasian),,TP53,20824210,"Alleles in candidate pathways (GH/IGF1 signaling, DNA damage signaling and repair and pro/antioxidants) were investigated for association with longevity in 1089 oldest-old (age 92-93) and 736 middle-aged Danes","Eleven SNPs (in GSR, KL, GHRHR, INS, GHSR, IGF2R, RAD52, WRN, RAD23B, POLB and NTLH1) were associated with longevity after correction for multiple hypothesis testing. No replications were observed in German and Dutch populations."
261,non-significant,American (Caucasian),,TP53,20824210,"Alleles in candidate pathways (GH/IGF1 signaling, DNA damage signaling and repair and pro/antioxidants) were investigated for association with longevity in 1089 oldest-old (age 92-93) and 736 middle-aged Danes","Eleven SNPs (in GSR, KL, GHRHR, INS, GHSR, IGF2R, RAD52, WRN, RAD23B, POLB and NTLH1) were associated with longevity after correction for multiple hypothesis testing. No replications were observed in German and Dutch populations."
280,significant,European,,TP53,23286790,Genome-wide linkage scan in 2118 European nonagenarian sibships and younger controls from various European studies followed by genome-wide association study in a subgroup of 1228 unrelated nonagenarian and 1907 geographically matched controls,"Four regions showed linkage to longevity (14q11.2, 17q12-q22, 19p13.3-p13.11 and 19q13.11-q13.32)"
281,significant,European,,TP53,23286790,"The -11377C > G, -11391G > A, and -11426A > G promoter polymorphisms of ADIPOQ were studied for association with longevity in 148 centenarians and 414 young controls",A very rare AA genotype of the -11391G > A polymorphism was significantly more common in centenarians than in young controls
282,significant,European,,TP53,23286790,Genome-wide association study in 801 centenarians and 914 healthy controls,"rs2075650, in a TOMM40 intron but a proxy of SNPs defining APOE alleles, was highly significant for exceptional longevity"
283,significant,European,,TP53,23286790,"Functional SNPs have been determined for 1071 unrelated healthy individuals (502 males and 569 females) from Central Italy, 18-106 years old, divided into three gender-specific age classes defined according to demographic information and accounting for the different survivals between sexes. The categories for men were: individuals <66 years old, individuals 66-88 years old, and individuals > 88 years old. The categories for women were: individuals <73 years old, individuals 73-91 years old, and individuals > 91 years old.",Single-locus analysis showed that when comparing all 3 age categories only ADA 22G>A (rs73598374) is significantly associated with human life-expectancy in males
293,non-significant,Chinese,,TP53,19641616,"Surviving participants of a 30-year-old population-based health survey (N = 310; age range, 90–109 years; the 90+ Study) were genotyped/resequenced at the DRD4 gene and compared with a European ancestry-matched younger population (N = 2902; age range, 7–45 years)",Oldest-old population carrying the DRD4 7R allele was higher relative to the younger sample (p = 3.5 × 10−9). And DRD4 7R genotype was strongly correlated with increased levels of physical activity.
334,non-significant,English (Newcastle),,TP53,23639206,"A total of 598 subjects (293 men and 305 women, age range 64–105 years; mean ages 82.74 and 85.23 years, respectively) were analyzed for genetic variability in Uncoupling Proteins (UCPs). The set was divided into two age classes. The separation threshold for these two classes was 88 years for men and 91 years for women.","Using the minor allele for each SNP as reference and after adjusting for BMI and sex, the dominant model for the rs660339 (UCP2) and the rs1800849 (UCP3) resulted to be significantly associated with the longevity phenotype (p = 0.001 in both cases), while the recessive model was the most likely for SNPs rs15763 (UCP3), rs9472817 (UCP4) and rs2235800 (UCP5) (p < 0.05). After adjusting for multiple testing, all the previous associations remained statistically significant, except those for rs2235800 of the UCP5 gene (p= 0.058)."
348,non-significant,American (Utah),,TP53,22506048,11 Japanese centenarians and 43 controls were sequenced to identify the substitution differences between centenarians and controls. Then the identified variants were examined in 37 centenarians and 252 healthy controls.,"All tested centenarians with both Mt8414T and Mt3010A carried Mt5178A. Mt5178A was related to longevity, and Mt5178C carriers were more susceptible to adult-onset diseases than those with Mt5178A."
349,non-significant,American (Utah),,TP53,22506048,11 Japanese centenarians and 43 controls were sequenced to identify the substitution differences between centenarians and controls. Then the identified variants were examined in 37 centenarians and 252 healthy controls.,"All tested centenarians with both Mt8414T and Mt3010A carried Mt5178A. Mt5178A was related to longevity, and Mt5178C carriers were more susceptible to adult-onset diseases than those with Mt5178A."
350,non-significant,American (Utah),,TP53,22506048,"354 individuals (18 - 95 years, mean age 55.35 ± 19.16 y; 175 females (20–95 years, mean age 55.44 ± 19.15 years) and 179 males (18–92 years, mean age 55.27 ± 19.22 years) were classified into four age groups as 20–40, 41–60, 61–80, >80. Then, IL-6 and MT2A polymorphisms were genotyped for longevity association study.",MT2A polymorphism was statistically analyzed in according to age groups and significant association was detected (p < 0.05). MT2A −5 G− carriers are more advantageous for longevity.
375,significant,Finnish,,TP53,12483296,"Inherited mtDNA markers were analyzed between a sample of individuals selected for successful aging and longevity (212 subjects older than 100 years and in good clinical condition) and a sample of 275 younger individuals (20–75 years, median age 38 years) carefully matched as to sex and geographic origin",Male centenarians emerged in northern Italy as a particular sample: 1) mtDNA haplogroup frequency distribution was different between centenarians and younger individuals (P=0.017 by permutation tests); and 2) the frequency of the J haplogroup was notably higher in centenarians than in younger individuals (P=0.0052 by Fisher exact test). MtDNA  inherited variability could play a role in successful aging and longevity.
379,significant,Italian,,TP53,10463944,"Associations between variation in SNPs in the SIRT1 gene and human survival were investigated in 1,390 subjects from a general population-based cohort with 18 years of follow-up",Carriers of the minor allele of rs12778366 had better glucose tolerance and had a significantly reduced mortality risk compared to the wild types (HR = 0.69).
387,significant,"European (Danish, Finnish, South Italian and Greek)",,TP53,24341918,Allele and genotype distributions of rs1333049 were compared in centenarians and younger adults (without (healthy) or with CAD) in two independent cohorts: Spanish and Japanese.,"The frequency of the GG genotype in centenarians was higher than either healthy or CAD controls in Spanish.  In the Japanese cohort, C allele did not differ between centenarians and healthy controls, but it was significantly lower in centenarians than in CAD controls."
