id,Association,Population,Variant(s),Gene(s),PubMed,Study Design,Conclusions
113,non-significant,Irish,-330T/G,IL2,12714268,"100 control samples (59% female and 41% male) and 93 aged consecutive samples (70% female, 30% male with an age range of 80-97 years) were analyzed for Intron 1 A/T SNP",No significant differences were observed in centenarians and controls
115,non-significant,Irish,IL8,CXCL8,12714268,"100 control samples (59% female, 41% male with an age-range of 19-45 years old) and 93 aged samples (70% female, 30% male with an age-range of 80-97 years old) were examined",No age-related allele or genotype frequencies were observed
116,non-significant,Irish (Belfast),HLA-A,HLA-A,12714268,"100 control samples (59% female, 41% male with an age-range of 19-45 years old) and 93 aged samples (70% female, 30% male with an age-range of 80-97 years old) were examined",No age-related allele or genotype frequencies were observed
117,non-significant,Irish (Belfast),HLA-B,HLA-B,12714268,"100 control samples (59% female, 41% male with an age-range of 19-45 years old) and 93 aged samples (70% female, 30% male with an age-range of 80-97 years old) were examined for 252A/G SNP",No age-related allele or genotype frequencies were observed
118,non-significant,Irish (Belfast),HLA-DRB3,HLA-DRB3,12714268,"100 control samples (59% female, 41% male with an age-range of 19-45 years old) and 93 aged samples (70% female, 30% male with an age-range of 80-97 years old) were examined for the -308A/G SNP",No age-related allele or genotype frequencies were observed
119,non-significant,Irish (Belfast),252A/G,LTA,12714268,"The (T/C, 97347 bp) polymorphism was examined in healthy people 17-85 yr of age (n= 278; mean age, 54.8; 76 males and 202 females) and in healthy people 86-109 yr of age (n= 218; mean age, 98.0; 56 males and 162 females)",No significant differences relative to longevity were found
121,non-significant,Italian,97347T/C,FOXO1,12843179,"T/C, 359 bp and A/G, 303 bp polymorphisms were examined in healthy people 17-85 yr of age (n= 278; mean age, 54.8; 76 males and 202 females) and in healthy people 86-109 yr of age (n= 218; mean age, 98.0; 56 males and 162 females)","No significant differences relative to longevity were found, though some differences in genotype combinations with IGF1R were observed"
122,non-significant,Italian,IRS1,IRS1,12843179,Polymorphism at codon 192 (Gln/Arg) was examined in 256 healthy Caucasian men (69.8 +/- 4.0 years),Gln homozygotes are more frequent in aging than Arg allele carriers
123,non-significant,Italian,PIK3CB,PIK3CB,12843179,"I/D polymorphism was examined in 82 centenarians and 252 middle-aged, unrelated subjects or volunteers",No statistically significant differences were found in ACE genotype or allele frequencies between centenarians and controls
126,non-significant,American,I550V,SLC13A2,14499494,I/D polymorphism was examined in 834 persons aged 10-104 years,An association between the DD genotype and D allele and age was observed in the European group only. The ACE polymorphism-age association occurred at age >60 years in the European population with decreasing II frequency.
129,non-significant,Japanese,SHC1,SHC1,14530863,G477T exon 3 SNP was examined in 801 unrelated subjects: 331 males and 470 females (120 centenarians: 36 males and 84 females) and controls 18-60 years old,"In males the TT genotype increases, while the GT genotype decreases survival in the elderly"
130,significant,Ashkenazi Jewish,I405V,CETP,14559957,I/D polymorphism was examined in 97 elderly subjects and control group aged 25-64,Frequency of D/D genotype among senile and long-living men was significantly lower than in men 55-64 years of age. A similar decrease of this gene frequency was also found in women of the same age.
131,significant,Italian (Southern),G477T,SIRT3,14580859,Common polymorphism was examined in 97 elderly subjects and control group aged 25-64,In men aged 83 years and older the frequency of the E3/E4 genotype was lower and that of the E2/E3 genotype was higher. In subjects of senile age and long-livers of both sexes genotype E4/E4 was not found.
134,non-significant,Dutch,Met(410)Val,SHC1,15036421,PON1 55 (L/M) and 192 (Q/R) polymorphisms were studied in 308 Italian centenarians and 579 adult controls and 296 Irish octo/nonagenarians and 296 young controls,There was a significant difference in 192 genotypes in Italian centenarians compared to younger controls and a similar but non-significant trend between octo/nonagenarian and young subjects in Ireland. Distribution of the 55 (L/M) polymorphism frequencies were similar in both groups.
136,non-significant,Bulgarian,HLA-A,HLA-A,15050300,"10 alleles were examined in 17 unrelated elderly (age 65-90 years; 6 males and 11 females), 23 family members (age 18-57 years; 9 males and 14 females, and a control group with 105 randomly selected, matched for geographical distribution healthy controls aged 25-53 years (40 male and 65 female)","The most frequent HLC alleles in elderly Bulgarians were C*07 and C*04, though differences were not statistically significant after correcting for multiple testing"
137,non-significant,Bulgarian,HLA-B,HLA-B,15050300,"874T/A SNP was examined in 17 unrelated elderly (age 65-90 years; 6 males and 11 females), 23 family members (age 18-57 years; 9 males and 14 females, and a control group with 105 randomly selected, matched for geographical distribution healthy controls aged 25-53 years (40 male and 65 female)",No significant association with longevity was found
138,non-significant,Bulgarian,HLA-C,HLA-C,15050300,"-174G/C SNP was examined in 17 unrelated elderly (age 65-90 years; 6 males and 11 females), 23 family members (age 18-57 years; 9 males and 14 females, and a control group with 105 randomly selected, matched for geographical distribution healthy controls","GC genotype was higher in elders while GG genotype was lower in elders, though differences were not statistically significant after correcting for multiple testing"
141,non-significant,Bulgarian,TGFB1,TGFB1,15050300,A 22 bp deletion was examined in 180 aged individuals (90-97 years) and 180 controls (19-45 years),There was no observed association between this common polymorphic variation and the aged Irish population
143,non-significant,Irish,KIR3DL1,KIR3DL1,15130674,A/V codon 114 SNP was examined in 187 centenarians (47 males and 140 females) and 201 controls (20-64 years),No significant association with longevity was found
144,non-significant,Danish,GP1BA,GP1BA,15177664,The 1-bp guanine deletion/insertion (4G/5G) polymorphism was examined in the promoter region in 187 centenarians (47 males and 140 females) and 201 controls (20-64 years),No significant differences relative to longevity were found
145,non-significant,Danish,114A/V,MTHFR,15177664,V432L SNP was examined in 205 octogenarians and a reference group of 294 persons aged less than 80 years,"In octogenarians, the 432L allele was significantly less prevalent than in the reference group"
147,significant,German,V432L,CYP1B1,15177664,I105V SNP was examined in 205 octogenarians and a reference group of 294 persons aged less than 80 years,There were slightly fewer observed heterozygous 105IV genotypes and more homozygous 105VV genotypes
148,non-significant,German,GSTM1,GSTM1,15177664,Deletion was examined in 205 octogenarians and a reference group of 294 persons aged less than 80 years,Octogenarians had slightly less GSTT1 deficient genotypes
149,non-significant,German,I105V,GSTP1,15177664,"The -110A/C polymorphism was examined in a cohort of aged Danish twins (individuals aged between 70 and 91 years, categorized according to the presence or absence of various diseases)",An association was found between low self-rated health and heterozygosity (AC genotype)
150,non-significant,German,GSTT1,GSTT1,15177664,"The T/C (2437 coding) polymorphism was examined in a cohort of aged Danish twins (individuals aged between 70 and 91 years, categorized according to the presence or absence of various diseases)",No association with longevity was found
152,non-significant,Danish,2437T/C,HSPA1L,15190186,The Pro/Ala polyporphism at codon 12 was studied in 222 long-lived subjects and 250 aged subjects,A different genotype frequency was observed between long-lived and aged men; no differences were observed in the two age groups of women.
153,significant,Italian (Sicily),-107T/C,PON1,15236768,The -262C/T polymorphism was examined in 2223 Danish individuals aged 45-93 years,The -262C/T polymorphism was not associated with survival
154,significant,Italian,PPARG,PPARG,15236769,-174 G/C promoter polymorphism was examined in a population of 81 centenarians compared with a control group of 122 middle-aged healthy subjects,No differences were found in allele and genotype frequencies between centenarians and controls
156,non-significant,Danish,-262C/T,CAT,15241482,"Two coding polymorphisms, 55M/L and 192Q/R, and a promoter variant, -107C/T, were studied in 1932 Danish individuals aged 47-93 years","A cross-sectional study comparing the genotype distribution of the three polymorphisms as well as the haplotype distribution in different age groups did not reveal any difference. However, a longitudinal follow-up study on survival in the same sample indicated that 192RR homozygotes have a poorer survival of coronary heart disease compared to QQ homozygotes."
160,significant,Dutch,ER22/23EK,NR3C1,15276593,"112 (36 male, 76 female) centenarians, as well as 137 sixty-year-old controls, were analyzed for 874T/A SNP",No significant differences were observed between centenarians and controls
161,non-significant,Irish,KIR3DL1,KIR3DL1,15288696,"112 (36 male, 76 female) centenarians, as well as 137 sixty-year-old controls, were analyzed for -1082G/A SNP",No significant differences were observed in centenarians and controls
165,significant,Italian,Asp299Gly,TLR4,15547160,"5 intronic and 1 exonic polymorphisms were examined in 122 semisupercentenarians (older than 105, 107 female, 15 male, mean age 106.8 years) and 122 healthy younger controls (105 female, 17 male, mean age 33.33)","One haplotype, which was comprised of 2 intronic SNPs in linkage disequilibrium, was more frequent in semisupercentenarians than in younger controls"
167,non-significant,Japanese,FOXO1,FOXO1,15582274,"2 exonic polymorphisms were examined in 122 Japanese semisupercentenarians (older than 105, 107 female, 15 male, mean age 106.8 years) and 122 healthy younger controls (105 female, 17 male, mean age 33.33)",No significant differences relative to longevity were found
168,significant,Japanese,INSR,INSR,15582274,"1 intronic polymorphism was examined in 122 semisupercentenarians (older than 105, 107 female, 15 male, mean age 106.8 years) and 122 healthy younger controls (105 female, 17 male, mean age 33.33)",No significant differences relative to longevity were found
169,non-significant,Japanese,IRS1,IRS1,15582274,"2 promoter and 1 intron polymorphisms were examined in 122 semisupercentenarians (older than 105, 107 female, 15 male, mean age 106.8 years) and 122 healthy younger controls (105 female, 17 male, mean age 33.33)",No significant differences relative to longevity were found
170,non-significant,Japanese,PIK3CB,PIK3CB,15582274,"2 exonic polymorphisms were examined in 122 semisupercentenarians (older than 105, 107 female, 15 male, mean age 106.8 years) and 122 healthy younger controls (105 female, 17 male, mean age 33.33)",No significant differences relative to longevity were found
171,non-significant,Japanese,PIK3CG,PIK3CG,15582274,Common polymorphism was examined in 224 older (75 years) Jewish Jerusalem residents of Ashkenazi ethnicity (150 males and 74 females) and in a group of 441 younger subjects (22 years),"Ashkenazi older subjects were characterized by an increased percentage of the E2 allele and a decreased percentage of the E4 allele, though this was not significant after correcting for multiple testing"
172,non-significant,Japanese,PPARGC1A,PPARGC1A,15582274,Arg/Gln R353Q SNP was examined in 224 older (>75 years) Jewish Jerusalem residents of Ashkenazi ethnicity (150 males and 74 females) and a group of 441 younger subjects (22 years),"There was a decrease in the percentage of the A allele in older Ashkenazi male subjects and a corresponding marked decrease (9.7-2.1%) in the percentage of AA homozygotes, though this was not significant after correcting for multiple testing"
174,non-significant,Ashkenazi Jewish (Jerusalem),Arg/Gln R353Q,F7,15621215,C677T SNP was examined in 224 older (75 years) Jewish Jerusalem residents of Ashkenazi ethnicity (150 males and 74 females) and a group of 441 younger subjects (22 years),"There was an increase in C allele frequency (67.4% versus 55.3%) in the older Ashkenazi females and an increase in the percentage of CC homozygotes, though this was not significant after correcting for multiple testing"
175,significant,Ashkenazi Jewish (Jerusalem),A/G ApaI site,IGF2,15621215,"C9T, Ala (GCT) to Val (GTT), SNP was examined in 224 older (75 years) Jewish Jerusalem residents of Ashkenazi ethnicity (150 males and 74 females) and a group of 441 younger subjects (22 years)","There was an increase in the percentage of T allele (51% versus 33.3%) in older Ashkenazi male subjects and a corresponding increase in the percentage (45.5% versus 25%) of TT homozygotes, though this was not significant after correcting for multiple testing"
177,non-significant,Ashkenazi Jewish (Jerusalem),C9T,SOD2,15621215,"A VNTR polymorphism (72-bp repeat core) in intron 5 was analyzed in 945 subjects (312 males and 391 females of 20- to 80-year-old and 242 subjects 90- to 106-year-old, median age 102 years)",The VNTR region has an allele specific enhancer activity. The allele completely lacking enhancer activity (allele 2) is virtually absent in males older than 90 years. Age effects were not observed in females.
179,significant,Italian (Southern),VNTR,SIRT3,15676284,CA repeat (promoter) and CT repeat (intron 2) were examined in 1576 individuals aged >85,"CA repeats (191 bp minor allele) seem to contribute most to female longevity, though this was not statistically significant"
180,significant,Dutch,GH1,GH1,15771611,Codon 57 A/G SNP was examined in 1576 individuals aged 85 and older,No association with longevity was found
181,non-significant,Dutch,GHRHR,GHRHR,15771611,VNTR repeat (promoter) was examined in 1576 individuals aged >85,No significant association with longevity was found
182,non-significant,Dutch,IGF1,IGF1,15771611,Promoter C/T SNP and 45 bp insertion/deletion (3'UTR) were examined in 1576 individuals aged >85,No association with reduced mortality risk was found
183,non-significant,Dutch,INS,INS,15771611,Codon 972 A/G SNP was examined in 1576 individuals aged >85,"Arg allele seems to contribute to longevity in females, though this was not statistically significant"
184,non-significant,Dutch,IRS1,IRS1,15771611,Exon 16 C/T SNP was examined in 1576 individuals aged >85,No association with reduced mortality risk was found
185,non-significant,Dutch,16C/T,SOD2,15771611,"The I405V polymorphism was examined in 175 Italian centenarians and, as a control group, 189 sex-matched healthy individuals",No association with longevity was found
186,non-significant,Dutch,UCP2,UCP2,15771611,Genotypes were studied in 2224 men and women aged 65 or older at baseline,"During 10 years of follow-up, men with the -438 A/A genotype had decreased mortality due to all causes, and lived, on average, longer than men with the -438 G allele. The effects of -438 G/A in women were smaller and not statistically significant."
187,non-significant,Italian,I405V,CETP,15888337,Genotypes for -455 G/A were studied in 2224 men and women aged 65 years and older at baseline,"During 10 years of follow-up, no association with survival was found"
188,significant,American (Caucasian),-438A/G,CPB2,15939070,Genotypes for -675 4G/5G were studied in 2224 men and women aged 65 years and older at baseline,"4G/4G genotype appeared to be associated with lower non-cardiovascular mortality in men, but with greater cardiovascular mortality in women"
193,significant,Japanese,SLC6A4,SLC6A4,16095668,329 healthy individuals were examined for 2576A-->G (D919G) polymorphism,Prevalence of the G-allele was significantly higher in the older than in the younger individuals. Separate analysis of female and male subjects revealed that the influence of the MTR genotype on male subjects became relevant at a younger age as opposed to female subjects suggesting a gender-dependent effect.
194,significant,German,D919G,MTR,16142417,"A total of 71 healthy elders were studied, age ranged from 80 to 96 years (mean 86.2 years). The control samples were obtained from 99 young (from 21 - 54 years; mean 35.2 years) healthy individuals unrelated to elders.","An increased frequency of HLA-DRB1*11 was found in elderly women whereas this allele was not present in elderly males, though no significant differences between age groups were observed"
195,non-significant,German,SIRT1,SIRT1,16257164,"71 healthy elders were studied, ages ranged from 80 to 96 years (mean 86.2 years). The control samples were obtained from 99 young (from 21 - 54 years; mean 35.2 years) healthy individuals unrelated to elders.",The frequencies of the alleles tested were not statistically different among groups
196,non-significant,Mexican,HLA-B,HLA-B,16269080,"A total of 71 healthy elders were studied, age ranged from 80 to 96 years (mean 86.2 years). The control samples were obtained from 99 young (from 21 - 54 years; mean 35.2 years) healthy individuals unrelated to elders.",The frequencies of the alleles tested were not statistically different among groups
197,non-significant,Mexican,HLA-DQA1,HLA-DQA1,16269080,"3 MEFV associated mutations, M694V (A2080G), M694I (G2082A) and V726A (T2177C), were examined in 121 patients affected by acute myocardial infarction (AMI), 68 centenarians, and 196 age-matched controls from Sicily.","The proinflammatory M694V (A2080G) mutation was over-represented significantly in coronary heart disease patients and under-represented in oldest old, and intermediate values were in healthy, young controls"
198,non-significant,Mexican,HLA-DRB1*11,HLA-DRB1,16269080,"The frequency of the -308 polymorphism was analyzed in 71 healthy elders, aged 80 to 96 years (mean 86.2 years). The control samples were obtained from 99 young (from 21 - 54 years; mean 35.2 years) healthy individuals unrelated to elders were studied, age ranged from 80 to 96 years (mean 86.2 years).",The TNF2 allele was increased in the elder group when compared to young controls
200,significant,Italian (Sicily),M694V,MEFV,16387839,"-607 A/C SNP was evaluated with age or gender in 500 Japanese persons (mean age: 56.7 years old, range: 19-100)",-607 A/C polymorphism is gender age associated but not in a significant manner
201,significant,Japanese,-819C/T,IL10,16424284,"-511 C/T SNP was evaluated with age or gender in 500 Japanese persons (mean age: 56.7 years old, range: 19-100)",No association with longevity was found
202,non-significant,Japanese,-607A/C,IL18,16424284,"-634 C/G SNP was evaluated with age or gender in 500 Japanese persons (mean age: 56.7 years old, range: 19-100)",No association with longevity was found
203,non-significant,Japanese,-511C/T,IL1B,16424284,"-1607 1G/2G SNP was evaluated with age or gender in 500 Japanese persons (mean age: 56.7 years old, range: 19-100)",-1607 1G/2G was not found to be longevity associated
204,non-significant,Japanese,-634C/G,IL6,16424284,"-1031 T/C SNP was evaluated with age or gender in 500 Japanese persons (mean age: 56.7 years old, range: 19-100)","Though not statistically significant, the -1031 T/C polymorphism may be associated with age"
205,non-significant,Japanese,-1607 1G/2G,MMP1,16424284,"-1171 5A/6A SNP was evaluated with age or gender in 500 Japanese persons (mean age: 56.7 years old, range: 19-100)",-1171 5A/6A polymorphism is gender age associated but not in a significant manner
206,non-significant,Japanese,-1171 5A/6A,MMP3,16424284,"+869 C/T SNP was evaluated with age or gender in 500 Japanese persons (mean age: 56.7 years old, range: 19-100)",The +869 C/T polymorphism was not found to be associated with longevity
207,non-significant,Japanese,869T/C,TGFB1,16424284,-330T/G SNP was examined in 168 centenarians and 214 control subjects matched for age and ancestry,No significant difference between centenarians and controls was observed
208,non-significant,Japanese,-1031T/C,TNF,16424284,T241M and a [AC]n microsatellite in intron 3 polymorphisms were examined in a cohort of newborns (n=290) and a retired population (average age at sampling 70.02 years; n=430),No evidence of association with longevity was found
209,non-significant,Italian (Central and Southern),-330T/G,IL2,16518704,I134T polymorphism was examined in a cohort of newborns (n=290) and a retired population (average age at sampling 70.02 years; n=430),No evidence of association with longevity was found
210,non-significant,English,T241M,XRCC3,16518718,[GAPyA]n microsatellite located 120 kb 5' of XRCC5 was examined in a cohort of newborns (n=290) and a retired population (average age at sampling 70.02 years; n=430),No evidence of association with longevity was found
211,non-significant,English,I134T,XRCC4,16518718,The GSTM1 deletion polymorphism was examined in a longitudinal study of 681 elderly Danish twins (234 men and 447 women),A non-significant trend for carriage of two copies of the GSTM1 functional gene was found
212,non-significant,English,XRCC5,XRCC5,16518718,Deletion polymorphism was examined in a longitudinal study of 681 elderly Danish twins (234 men and 447 women),Both heterozygosity and homozygosity for the GSTT1 functional gene were associated with a moderate but significant increased mortality in women
213,non-significant,Danish,GSTM1,GSTM1,16574194,"A group of centenarians (213), their offspring (216), and an age-matched control group (258) were genotyped for 66 polymorphisms in 36 candidate genes related to cardiovascular disease","The prevalence of homozygosity for the 641C allele in the APOC3 promoter (rs2542052) was higher in centenarians (25%) and their offspring (20%) than in controls (10%). This genotype was associated with significantly lower serum levels of APOC3, a favorable pattern of lipoprotein levels and sizes. A lower prevalence of hypertension and greater insulin sensitivity in the 641C homozygotes was also found."
214,significant,Danish,GSTT1,GSTT1,16574194,"The 1249-1250InsACAA/Non-Ins polymorphism distribution was examined in 88 celiac disease patients, 99 age- and sex-matched controls, and 28 95-year-old healthy subjects",No significant differences relative to longevity were found
216,non-significant,Italian (Sicily),1249-1250InsACAA/Non-Ins,TGFB2,16608413,"129 centenarians and 154 sexagenarians randomly selected from the inhabitants of the same province were examined. In addition, 24 85-year-old sibs of centenarians were enrolled.",Sib pair analysis showed nonsignificant differences between the observed and expected percentage of DQB1* allele sharing.
217,non-significant,Italian (Sardinia),HLA-DQA1,HLA-DQA1,16608414,The A/C -110 polymorphism was examined in 426 participants of various ages,Female carriers of CC genotype survive better than the noncarriers (AA and AC)
218,non-significant,Italian (Sardinia),HLA-DQB1,HLA-DQB1,16608414,"A locus associated with human longevity corresponds to a (TG)n microsatellite in the YTHDF2 gene. 412 participants of different ages, including 137 centenarians, were genotyped.","The increased homozygosity in centenarians at this locus was confirmed, and observed a concomitantly increased frequency of the most frequent allele and the corresponding homozygous genotype. The same genotype was associated with increased YTHDF2 messenger RNA levels in immortalized lymphocytes."
219,significant,Italian,YTHDF2,YTHDF2,16799135,The A/G (1267 coding) polymorphism was examined in 426 participants of various ages,Female carriers of GG genotype survive better than noncarriers
221,significant,Danish,1267A/G,HSPA1B,16804002,The FCGR2A-His131Arg polymorphism was analyzed in a group of 408 German centenarians and two samples of younger Germans aged 60-75 and 18-49 years,No statistically significant differences were observed between the three age groups
222,non-significant,German,FCGR2A-His131Ar,FCGR2A,16893392,The association of sex and age with the occurrence of ACE genotypes in healthy aging and longevity in 1344 healthy individuals and 64 centenarians was examined,A significant association of D allele and age was observed in centenarians
223,significant,Italian,647A/C,MT1A,16955215,"The frequency of CNDP1 alleles in German centenarians (n=330), patients with premature coronary heart disease, and matched controls was examined. A total of 1382 individuals were examined.","There was no difference in allele or genotype frequency between centenarians and their control group, or between cardiovascular patients and their control group"
226,non-significant,German,CNDP1,CNDP1,16965804,"The distribution of AAT allele variants was examined in 127 young patients affected by acute myocardial infarction (AMI), 255 young controls and 143 centenarians","The Z allele frequency was most frequent in centenarians, intermediate in healthy young controls and less frequent in AMI patients. The heterozygous MZ genotype was significantly over-represented in centenarians and under represented in AMI patients with intermediate values in young controls (16/255)."
