id,Association,Population,Variant(s),Gene(s),PubMed,Study Design,Conclusions
228,non-significant,Columbian,APOE,APOE,16971231,"The genotype and allele frequency distribution of I/D polymorphisms were analyzed in 235 Italian patients with sporadic Alzheimer disease, 153 with familial Alzheimer disease, 192 healthy controls and 111 centenarians","There were no significant differences in ACE genotypes or allele frequencies in all the studied groups. Centenarians showed the highest allele D frequency, although the value was not statistically significant."
233,non-significant,German,Asp299Gly,TLR4,17493663,"A total of 1,089 (669 women and 420 men) unrelated individuals from 19 to 109 years, born and residing in northern and central Italy, were subdivided into three age classes, and genotyped for the KL-VS allele","Significant increase of the heterozygous Klotho genotype was found in the class of elderly people compared to young controls. However, no difference was present between centenarians and young controls."
234,non-significant,Ashkenazi Jewish,IGF1,IGF1,18316725,Analysis was performed in 149 centenarians (mean age 101.1 years old) and in 413 young subjects (mean age 27.1 years old).,"The distribution of the Lys751Gln genotypes differed significantly between these groups (P = 0.017). In centenarians, the homozygous genotypes AA and CC were found less frequently than in young controls (29 vs. 36%, OR = 0.71, and 14 vs. 20%, OR = 0.652, respectively). The Arg156Arg and Asp312Asn were not significantly associated with extreme longevity."
235,significant,Italian,KL-VS,KL,19421891,"TSH heritability, its distribution, and association with SNPs in the TSH-B and TSHR genes was determined in Ashkenazi Jewish centenarians (n = 232; median age, 97 yr), their offspring (n = 366; median age, 69 yr), and age-matched controls without familial longevity (n = 163; median age, 70 yr)",The SNPs in TSHB did not show significant changes between cases and control
236,significant,Polish,Lys751Gln,ERCC2,19707883,"The distribution of the CHIT-1 polymorphism genotype was compared in three different populations of the Mediterranean area (Italian, Greek and Tunisian) aged over 90 years. As a control group for each nonagenarian and centenarian, a 60-70-year-old subject was genotyped.","The heterozygote frequency for the 24-bp duplication in the CHIT-1 gene was significantly different between oldest old subjects and control subjects, being highest among the oldest old subjects and lowest among control groups. In the oldest old group, no subject was observed to be homozygous for CHIT-1 deficiency."
237,non-significant,Ashkenazi Jewish,TSHB,TSHB,19837933,"In a cohort of Ashkenazi Jewish centenarians, their offspring, and offspring-matched controls, the inheritance and maintenance of telomere length and variations in hTERT and hTERC were studied","Sequence analysis of hTERT and hTERC showed overrepresentation of synonymous and intronic mutations among centenarians relative to controls. Moreover, common hTERT haplotype was associated with both exceptional longevity and longer telomere length."
238,significant,"Mediterranean (Italian, Greek and Tunisian)",CHIT1,CHIT1,19881466,"Six hundred seventy-seven participants (289 males and 388 females) between 16 and 104 years of age, categorized as long lived (LL; >85 years old) or controls (C; <85 years old), were genotyped for Gly1057Asp-IRS2 locus variability (rs1805097)","Homozygous IRS2(Asp/Asp) participants were more represented among LL versus C participants (16.7% vs 12.0%; p = .04) and were more likely to reach extreme old age (>/=90 percentile, 96-104 years; odds ratio: 2.03, 95% CI = 1.39-2.99;p = .0003). The association between IRS2 gene polymorphism with longevity (being LL) was independent of anthropometric and metabolic covariates (odds ratio: 2.07, 95% confidence interval [CI] = 1.38-3.12; p = .001)."
239,significant,Italian,Gly1057Asp-IRS2,IRS2,19887537,"In a cohort of Ashkenazi Jewish centenarians, their offspring, and offspring-matched controls, the inheritance and maintenance of telomere length and variations in hTERT and hTERC were studied","Sequence analysis of hTERT and hTERC showed overrepresentation of synonymous and intronic mutations among centenarians relative to controls. Moreover, common hTERT haplotype was associated with both exceptional longevity and longer telomere length."
240,significant,Ashkenazi Jewish,TERC,TERC,19915151,"884 unrelated healthy individuals (age range 10-106 years, 400 males and 484 females) from central Italy were studied","An increased frequency of ADA*2 carriers was found in males aged 80-85, and a decreased frequency in males over 85 (v2 = 13.93; df = 3; P = 0.003); significant differences among the age groups was not found in females"
241,significant,Ashkenazi Jewish,TERT,TERT,19915151,Association study in 493 elderly Han Chinese individuals (females = 94; males = 90) and 425 young individuals (controls),"No association between the microsatellite polymorphism and longevity was found. However, there were more male persons with 18/21 genotype in elderly group than that in control group (11.11 vs. 5.45%, p = 0.011), though the difference was not significant when corrected for multiple testing."
242,significant,Italian,ADA*2,ADA2,20174870,"SNPs rs266729 (-11377G/C), rs2241766 (+45T/G), and rs1501299 (+276 G/T) of adiponectin gene (ADIPQO) and rs7799039 (-2548C/A) SNP of leptin (LEP) gene were genotyped in 110 randomly selected elderly subjects (>85 years old) with mean age of 90.2 years, and 120 young control subjects (range from 20 to 50 years) with mean age of 32.0 years","No significant differences were detected in the genotype and allele frequencies of examined gene variants between the two groups (p > 0.05). However, when gender was considered, genotypes and alleles frequencies of rs1501299 SNP in ADIPOQ gene and rs7799039 in LEP gene were significantly associated with longevity in men (p < 0.02) but not in women (p > 0.05)."
243,non-significant,Chinese (Han),IGF1,IGF1,20199671,"SNPs rs266729 (-11377G/C), rs2241766 (+45T/G), and rs1501299 (+276 G/T) of adiponectin gene (ADIPQO) and rs7799039 (-2548C/A) SNP of leptin (LEP) gene were genotyped in 110 randomly selected elderly subjects (>85 years old) with mean age of 90.2 years, and 120 young control subjects (range from 20 to 50 years) with mean age of 32.0 years","No significant differences were detected in the genotype and allele frequencies of examined gene variants between the two groups (p > 0.05). However, when gender was considered, genotypes and alleles frequencies of rs1501299 SNP in ADIPOQ gene and rs7799039 in LEP gene were significantly associated with longevity in men (p < 0.02) but not in women (p > 0.05)."
247,significant,Italian (Palermo),DRB1*18,HLA-DRB1,20426625,IL-10 -1028 G/A and TNF-alpha-308 G/A were genotyped in 119 randomly selected elderly subjects (41 women and 78 men) with a mean age of 90.2 years and young control subjects of 118 (46 women and 72 men) with a mean age of 31.9 years,No significant differences were found in the genotype and allele frequencies of TNF-alpha gene variants between the two groups (P > 0.05). IL-10 genotype and allele frequencies were significantly associated with longevity in men (P < 0.05) but not in women (P < 0.05).
250,significant,American (Georgia and Louisiana populations from African and European origin),APOE,APOE,20569235,"The association of ESR1 (PvuII and XbaI) and CYP19 (rs4646) polymorphisms with longevity was examined in a sample of 258 individuals (mean age = 83.1 ± 5.7 years). Based on mortality data over 9 years, the sample was divided into two groups of participants surviving more than 90 years or not.",ESR1 PP (odds ratio = 2.2) and CYP19 genotypes carrying the T allele (odds ratio = 1.9) were significantly associated with longevity (survival to age more than 90 years)
252,significant,Italian (Salerno),ESR1,ESR1,20819792,"224 nonagenarian cases (84 male, 140 female, 90- 103 y) and 293 young controls (100 male, 193 female, 21- 59 y) from the Louisiana Healthy Aging Study were examined for longevity association study. Then, 170 subjects(25 male, 145 female, ≥98 y) and 220 young controls (84 male, 136 female, 20–59 y) from the Georgia Centenarian Study were examined to replicate the results.","rs132793 in XRCC6 had significant effect on telomere length, but it was not associated with longevity"
257,non-significant,German,TH01,TH,21407269,A genome-wide linkage scan on human longevity was performed in 279 families with multiple long-lived siblings,One locus on chromosome 9q31-34 was borderline significant and a peak on 12q24 was detected in a subset of the data. There was also modest evidence for a peak on 4q22-25.
285,significant,Polish,-11391G > A,ADIPOQ,23339001,A cross-sectional population study of 1072 individuals (18–106 years old) was performed and TP53 variants were analyzed,"The variant rs1042522 affects females longevity, showing significant associations with longevity in the comparison of individuals >91 years old with individuals aged 73-91 years old. The TP53 P72 allele is significantly underrepresented in the >91 years old women group."
287,significant,American (Caucasian),D4S1564,TP53,11526246,"A functional polymorphism in PTPN22 (R620W) was tested for survival to old age and reaching exceptional longevity.  For this purpose 892 unrelated healthy individuals (8-106 years, males and females) from central Italy were studied.","The frequency of PTPN22 1858C>T polymorphism did not differ significantly in nona/centenarians and octogenarians compared to young individuals. Further allele and genotype frequencies comparison of age groups of previously studies on 1393 control individuals with Italic ancestry confirmed this observation. Thus, this allele is not negatively selected at oldest ages."
290,significant,Italian (Central),MNS16A,TERT,23562826,"Twenty-eight mtDNA haplogroups were studied in 463 individuals with exceptional longevity (>95 years). As controls, 926 individuals aged 60-69 years (elderly group) and 463 individuals aged 40-49 years (middle-aged group) were used.","M9 haplogroups in longevity subjects were reduced and a decreasing trend of N9 frequency was also observed. An increasing trend of D4 frequency and a decreasing trend of B4a frequency were observed in females. None of the associations were significant, however, after controlling for multiple testing."
291,non-significant,Italian (Central),PTPN22,PTPN22,21113673,"102 SNPs from 16 longevity candidate genes were examined in Danish. 1089 individuals (ages 92.2-93.8, mean age 93.2, 71.3 female) and 736 middle-aged controls (46-55 y, mean age 50.6, 49.6% female) were involved in this case-control study. Then the results were replicated in a German cohort of 1613 individuals (95-110 y, 73.2% female) and 1104 middle-aged controls (mean age 67.2, SD 4.07, 74.3% female). A 11 years study was introduced in Danish cohort to identify the SNPs associated with longevity, then the results were verified in Dutch longitudinal cohort.","In a 11 years of follow-up study in the Danish, rs2069827 in IL6 was borderline significantly associated with survival from age 92 (P-corrected = 0.064). Investigation of the Dutch replication study supported an effect on late life survival."
297,significant,American (Caucasian),DRD4 7R,DRD4,23283341,"Genome-wide association study using 1,471 genotyped participants from the Framingham Heart Study, of which 1,173 individuals had known lifespans, plus 517 individuals from the Offspring cohort for validating connections between longevity and genetic variants",A total of 27 SNPs were identified at the intersection of various statistical procedures
327,non-significant,Chinese (Guangxi Bama),mt146A,TP53,22729909,Two polymorphisms were studied for effects on survival in 668 individuals aged 70-105.5 years and followed for 7 years,rs1800795 was not associated with longevity
335,non-significant,Polish,PRNP,PRNP,23406923,"A sample of 277 unrelated individuals (>70 years old, mean age, 82.9) was recruited in 2000 and genotyped. On the basis of mortality data collected in 2009, the sample was divided into two groups of subjects surviving over 90 years (long-lived) or not (controls).","The frequency of the FSHR 680 Ser/Ser genotype was significantly higher in the sample of long-lived women compared to controls, indicating that the FSHR 680 Ser/Ser genotype may favor survival to more than 90 years of age in women only"
341,significant,Italian (Southern),Pro12Ala,PPARG,22985084,"MSTN variants were analyzed in 540 individuals (cases, n = 156; 132 women, age range 100–111 years) and younger adults (controls, n = 384; 167 women, age <50 years) for the association with longevity. The results were replicated in an Italian cohort (centenarians, n = 79 (40 women), age range 100–104 years; younger controls, n = 316 (155 women), age <50 years).",The frequency of the variant R allele of the MSTN K153R(rs1805086) polymorphism was significantly higher in Spanish centenarians (7.1 %) than in controls (2.7 %) (P = 0.001). Similar results were found in Italian centenarians (7.6 %) compared to controls (3.0 %) (P = 0.004). The variant R allele is associated with exceptional longevity.
347,non-significant,American (Utah),D3S3547,TP53,22506048,A whole-genome scan for genetic linkage was performed in 325 individuals who exhibited high levels of both familial longevity and individual longevity,"There were no significant results after correcting for multiple testing. The strongest signal was observed in marker D3S3547, in 3p24.1, and other suggestive peaks were observed in 18q23-24, 8q23, and 17q21."
351,significant,Chinese (Zhuang),haplogroup F,ND5,21945877,"354 individuals (18 - 95 years, mean age 55.35 ± 19.16 y; 175 females (20–95 years, mean age 55.44 ± 19.15 years) and 179 males (18–92 years, mean age 55.27 ± 19.22 years) were classified into four age groups as 20–40, 41–60, 61–80, >80. Then, IL-6 and MT2A polymorphisms were genotyped for longevity association study.",A highly statistically significant association was detected for IL-6 genotype and allele frequencies in aging (p < 0.001). No significant difference was found between the two genders (p > 0.05). IL-6 −174 C+ carriers are more advantageous for longevity.
352,significant,Japanese,Mt5178A/C,ND2,9449878,"The association between HP polymorphisms and longevity was investigated in 1072 (569 females, 18-106 years) individuals that were divided into three gender-specific age classes. HP*1F/S subtyping was also performed to check the possible existence for a preferential advantage of HP*1F or HP*1S allele.","HP*1/*1 genotype results associated to increased probability of young subjects of attaining longevity (Comparison 1: O.R. 1.709, p=0.0114) with a concomitant advantage of HP*1 allele (Comparison 1: O.R. 1.273, p=0.0194). On the other side, carriers of HP*2 allele displayed an overall significant disadvantage in reaching Age Class 2 (O.R. 0.585, p=0.0092). No significant differences were noticed between age groups either considering total HP*1F and HP*1S allele frequencies or according to HP 1/2 genotypes. HP polymorphisms was associated with longevity."
353,significant,Japanese,Mt8414C/T,ATP8,9449878,"The association between five common polymorphisms in genes of this pathway and  extreme longevity were examined using a case (107 centenarian, 100–111 years, 89 female)-control (284 young adults, ≤50 years, 150 female) design.",The studied genetic variants of the PPARD-PPARGC1A-NRF-TFAM pathway were not associated with extreme longevity. A marginal association could exist for rs1937 in TFAM (p=0.003).
354,significant,Japanese,Mt3010G/A,RNR2,9449878,"630,309 SNPs were examined by genome-wide linkage and association study among 74 successfully aged (35% female, mean age 81.82 years) and 189 'normally aged' (67% female mean age 83.74 years) Amish adults over age 80.","There was evidence for linkage on 6q25-27 near the fragile site FRA6E region with a dominant model maximum multipoint heterogeneity LOD score p= 3.2. The 1-LOD-down support interval for this linkage contained one SNP for which there was regionally significant evidence of association (rs205990, p = 2.36 × 10−5). This marker survived interval-wide Bonferroni correction for multiple testing and was located between the genes QKI and PDE10A."
357,significant,Italian (Central),HP,HP,21147083,"rs189037 C/T genotype was examined in 128 Italian long-lived individuals (78.1 % females, 98.7 ± 5.1 years; 52.3 % > 100 years) and 150 controls  (56.7 % females, 67.2 ± 9.1 years) to study the association with longevity","There was association between the rs189037 C/T genotype and longevity in Italian centenarians, with an odds ratio of 1.85 (95 % CI 0.99-3.45)"
366,non-significant,Chinese (Han),MtC150T,TP53,21262335,The correlation between mitochondrial polymorphisms and the longevity phenotype was analyzed in 112 Japanese semi-supercentenarians and 672 previous published sequences from individuals with non-disease phenotypes,mtSNP 14979C (Cytb: Ile78Thr) in D4a was identified to be correlated with extreme longevity
367,non-significant,Jordanian,-9T/C,SOD2,20003469,"Four polymorphisms within the VEGF gene promoter region in 490 unrelated healthy subjects (40.2% males, 25- 99 years) were analyzed possible association with longevity","Significant changes of allele, genotype (−2578/AA versus −2578/CC: OR = 2.08, p = 0.007; −1190/AA versus −1190/GG: OR = 2.01, p = 0.011) and haplotype (AAGG: 10.4% versus 14.9%, p = 0.03) frequency distributions were observed between young/elderly (25–84 years old) and long-lived (85–99 years old) subjects. These results suggest that VEGF gene variability can influence lifespan."
371,significant,Japanese,14979C,TP53,18545700,"The frequencies of mtDNA haplogroups and haplogroup clusters were examined among elderly subjects and controls in a Finnish population: 225 persons aged 90 or 91 years (Vitality 90+, 179 women, 400 mid-age controls (18–65 years; mean age: 40.5 years)) and 257 infants (2–12 months; mean: 6.5 months))","Haplogroup H was less frequent among the Vitality 90+ cases than among the middle-aged subjects (P=0.001) and infants (P=0.00001), whereas haplogroups J, U and K were more frequent. Haplogroup clusters also differed between Vitality 90+ and both the middle-aged subjects (P=0.002) and infants (P=0.00001), the frequency of haplogroup cluster HV being lower in the former and that of UK and WIX being higher. MtDNA haplogroups or haplogroup clusters were associated with longevity."
372,significant,Italian (Northern),VEGFA,VEGFA,17574707,"The distribution of 874T/A polymorphism was examined in 174 Italian centenarians (>99 years old, 142 women) and 248 <60-year-old control subjects (90 women)","The +874T allele, known to be associated with low IFN-gamma production, was found less frequently in centenarian women than in centenarian men or in control women (p=0.02) whereas no significant differences were observed in the distribution of the two alleles between male or female controls. Allele frequencies in centenarian men were not found significantly different from male controls."
373,significant,"Ashkenazi Jewish, Czechs (Bohemian)",KL-VS,KL,15677572,APOE genotypes were assessed in 114 nonagenarians and 2071 younger controls (30-65 years),"The E4 allele was reduced in the nonagenarian group (X(2)=11.1; P=0.0006), the E3 unchanged and E2 frequency was increased (X(2)=4.0; P=0.047). Longevity is negatively associated with the E4 allele and may be associated with carriage of E2."
374,significant,Ashkenazi Jewish,CETP,CETP,15621216,"the relationship between APOE and longevity was analyzed among 1562 Han Chinese (ages ranged from 20-108 years, 246 female and 1316 male)","The allele frequency of APOE*4 in the very old age group (> or = 85 years) was significantly different from that in the youth (20-39 years), middle (40-59 years) and old (60-84 years) age group (2.5% vs 8.4, 7.9 or 7.6%; P < 0.05), respectively"
376,significant,Italian (Sicily),C282Y,HFE,11857056,"82 centenarians (64 females, 100- 106y, average 101.1y), 20 nonagenarians (16 females, 90- 99y, average 96.5y) and 159 healthy adults (81 females, 18- 88y, average 58.1y) were genotyped for associations with longevity involving 80 HLA antigen phenotypes.",Extremely low frequency of HLA-DRw9 and an increased frequency of DR1 were found in centenarians and nonagenarians populations. HLA-DRw9 was a risk factor for longevity (corrected P = 0.0001). HLA-DR1 was a favourable factor for longevity (corrected P = 0.00367). High frequency of HLA-DRw9 and low frequency of DR1 are known to be associated with autoimmune or immune deficiency diseases.
381,significant,Japanese,HLA-DQA1,HLA-DQA1,2889033,"Participants (n = 9,219) of the Copenhagen City Heart Study were genotyped for the p53 Arg72Pro polymorphism. Then the morbidity of 6 subtypes of cancer and mortality were assessed for each genotype.","The risk of hematologic cancer increased 2-fold in Arg/Pro heterozygotes vs. Arg/Arg homozygotes (p < 0.001), with a similar trend in Pro/Pro homozygotes. The overall 12-year survival after blood sampling was increased in Arg/Pro heterozygotes with 3% (p = 0.003) and in Pro/Pro homozygotes with 6% (p = 0.002) vs. Arg/Arg homozygotes. The cumulative 5-year mortality after a cancer diagnosis was reduced in Arg/Pro heterozygotes and Pro/Pro homozygotes vs. Arg/Arg homozygotes by 9% (p = 0.003) and 13% (p = 0.03). These results suggest a better prognosis in Arg/Pro heterozygotes and Pro/Pro homozygotes vs. Arg/Arg homozygotes after the diagnosis of cancer or other life-threatening disease."
382,significant,Japanese,HLA-DRB1,HLA-DRB1,2889033,-374T/A was investigated in subjects aged >=90 and middle-aged individuals.,Genotype AA and AT were associated with longevity in males. Allele A may have a protective role in aging.
383,significant,Irish,T2437C,HSPA1L,12742533,mtDNA sequences were analyzed in 4239 European individuals. 1292 individuals (646 ultranonagenarians and 646 controls) were selected for complete sequencing. The mtDNA subhaplogroups were determined in remaining 2947 samples (1449 ultranonagenarians and 1498 controls) to verify possible haplogroup association with longevity and the distribution pattern among European counties.,"The distribution of H2, T2 haplogroup in female and H1, J2 in male showed differences between older subjects and younger controls, but no association was detectable when corrected for multiple test. Mitochondrial DNA variation does affect human longevity, but its effect is heavily influenced by the interaction between mutations concomitantly occurring on different mtDNA genes."
388,significant,Caucasian,-374T/A,AGER,24284407,"Three SNPs in the SIRT3 gene were examined in 549 genomic DNA from Treviso Longeva study. A Cross-sectional analysis was carried out by comparing people over and under 85 years of age, followed by a longitudinal analysis considering mortality as the dependent variable.",Longitudinal analysis showed no association for rs3825075 in whole cohort and females.
389,significant,Spanish,E4,UBE4B,24534555,"A genome-wide association meta-analysis was performed in 7729 long-lived individuals of European descent (>=85 years) and 16,121 younger controls ( <65 years) followed by replication in an additional set of 13,060 long-lived individuals and 61 156 controls.",rs2149954 and rs4420638 were observed significantly associated with longevity. Meta-analysis showed rs2149954 (T) associates with increased survival.
391,non-significant,Chinese,I405V,CETP,24746514,Allele and genotype distributions of rs1333049 were compared in centenarians and younger adults (without (healthy) or with CAD) in two independent cohorts: Spanish and Japanese.,"The frequency of the GG genotype in centenarians was higher than either healthy or CAD controls in Spanish. In the Japanese cohort, C allele did not differ between centenarians and healthy controls, but it was significantly lower in centenarians than in CAD controls."
G397,significant,Japanese (Okinawa),"DQA10101=0104,DQA105",HLA-DQA1,9389323,Polymorphisms in HLA class II alleles of Okinawan centenarians were analyzed,DQA10101=0104 and DQA105 alleles were significantly more frequent in the centenarians
G398,significant,Japanese (Okinawa),"DQB105,DQB103",HLA-DQB1,9389323,Polymorphisms in HLA class II alleles of Okinawan centenarians were analyzed,DQB105 and DQB103 alleles were significantly more frequent in the centenarians
G399,significant,Japanese (Okinawa),"DRB1*1401,DRB1*0101,DRB1*1201",HLA-DRB1,9389323,Polymorphisms in Okinawan centenarians were analyzed,DRB1*1401 allele was significantly increased in the centenarians while DRB1*0101 and DRB1*1201 alleles were slightly decreased
G400,non-significant,French,"A2637,G1934A",CYP2D6,9654200,CYP2D63 (A2637 deletion) and CYP2D64 (G1934A transition) alleles were examined in 552 centenarians and 243 controls aged 20-70 years,No significant difference was found between centenarian and control subjects
G401,non-significant,French,"C481T,G590A,G857A,G191A",NAT2,9654200,"NAT25A (C481T), NAT26A (G590A), NAT27A (G857A), and NAT214A (G191A) SNPs were examined in 552 centenarians and 243 controls aged 20-70 years","No significant difference was found between centenarian and control subjects with respect to allelic variant frequencies, genotype distributions or predicted phenotypes deduced from genotype combinations"
G402,non-significant,French,"C402T,T1011C,G1215A,T2444C",PARP1,11097112,"324 centenarians and 324 controls were examined for C402T (exon 2), T1011C (exon7), G1215A (exon 8) and T2444C (exon 17) SNPs",No association with longevity or with increased cellular poly(ADP-ribosyl)ation capacity was observed
