id,Association,Population,Variant(s),Gene(s),PubMed,Study Design,Conclusions
G410,non-significant,Bulgarian,-819C/T,IL10,15050300,"-1082G/A, -819 C/T and -592 C/A SNPs were examined in 17 unrelated elderly (age 65-90 years; 6 males and 11 females), 23 family members (age 18-57 years; 9 males and 14 females, and a control group with 105 randomly selected, matched for geographical dist","Genotype -1082G/A, -819 C/C, -592 C/C was positively associated, while genotype -1082A/A, -819 C/T, -592 C/A, was negatively associated with longevity in Bulgarians. The results, however, were not statistically significant."
G410,non-significant,Bulgarian,-592C/A,IL10,15050300,"-1082G/A, -819 C/T and -592 C/A SNPs were examined in 17 unrelated elderly (age 65-90 years; 6 males and 11 females), 23 family members (age 18-57 years; 9 males and 14 females, and a control group with 105 randomly selected, matched for geographical dist","Genotype -1082G/A, -819 C/C, -592 C/C was positively associated, while genotype -1082A/A, -819 C/T, -592 C/A, was negatively associated with longevity in Bulgarians. The results, however, were not statistically significant."
G414,non-significant,German,Q/H 95,MTTP,15911777,"rs1800591, rs2866164, and Q/H 95 SNPs were examined in 1,039 unrelated individuals between 95 and 109 years of age (mean age, 98.2 years); 373 (36%) of the long-lived participants were centenarians or supercentenarians (mean age, 101.4 years). The sex ratio in the entire sample was 74% females vs. 26% males. A total of 540 control individuals aged between 60 and 75 years (mean age, 67.2 years) were used.",No evidence for association was detected between any of the tested SNPs at the allele or at the genotype level
G423,non-significant,Ashkenazi Jewish,APM1+2019,ADIPOQ,18511746,"Adiponectin levels and variants in the adiponectin gene (ADIPOQ) were studied in centenarians (n = 118), their offspring (n = 228), and unrelated participants <95 (n = 78)","Frequencies were not significantly different between probands and controls, though there was a suggestive difference in rs17300539 and APM1+2019 between male probands versus controls"
G423,non-significant,Ashkenazi Jewish,APM+2019,ADIPOQ,18511746,"Adiponectin levels and variants in the adiponectin gene (ADIPOQ) were studied in centenarians (n = 118), their offspring (n = 228), and unrelated participants <95 (n = 78)","Frequencies were not significantly different between probands and controls, though there was a suggestive difference in rs17300539 and APM1+2019 between male probands versus controls"
G525,Non-significant,Danish,-373(A)n(T)m,IL6,15130757,"IL6 (−597G/A, −572G/C and −174G/C) and the AT-stretch polymorphism (−373(A)n(T)m) were examined in 1710 Danish subjecta (47- 100y) to detect if a specific genotype or haplotype was associated with either longevity or increased mortality.","Four different −373(A)n(T)m alleles were detected in the Danish population; (A)8(T)12, (A)9(T)11, (A)10(T)10 and (A)10(T)11. The frequency of the (A)8(T)12 allele decreased slightly in the elderly group, yet not significantly (p>0.05). There was no difference in the −572G/C genotype distribution between age-groups."
G534,significant,Danish,s647126,UCP3,24462499,"38 genes (311 SNPs) belonging to pro-antioxidant pathways were investigated for the association with physical and cognitive performances in a Cohort of 1089 Danish nonagenarians. For each gene analyzed in the pro-antioxidant pathway, the influence on longitudinal survival was tested.","NDUFS1, TXNRD1, SOD2 and UCP3 were found significantly associated with lifespan in the female cohort. This result is consistent with their associations with physical functioning and suggests that the variability of genes in the pro-antioxidant pathway can influence survival through an effect on physical performances, at least in the analyzed cohort."
G552,non-significant,Danish,Q95H,MTTP,16015282,"1651 participants in the Danish 1905 cohort study (aged 92-93 years) were genotyped for two SNPs (rs2866164 and Q95H). Furthermore, a group of 575 middle-aged Danish twins (mean age 53.7 years) were tested as a younger control group.",The risk haplotype had no significant survival disadvantage after 6.5 years of follow-up. The distributions of the suggested risk alleles and the resulting haplotypes were not statistically different between the two age cohorts.
1,non-significant,Dutch,HLA-B40,HLA-B,1859103,"964 inhabitants aged 85 years and over and 2444 young controls, aged 20-35 years, with an identical ethnic and demographic background were examined","Without correcting for multiple testing, HLA-DR5 was higher in the group of 85 years and over, as compared to the control group"
2,non-significant,Dutch,HLA-DRB5,HLA-DRB5,1859103,The apolipoprotein B Xba I polymorphism was examined in 179 Finnish centenarians,The frequencies of the Xba I alleles among the centenarians and among the young Finns were not significantly different
3,non-significant,Finnish,APOB,APOB,8018664,"964 inhabitants aged 85 years and over and 2444 young controls, aged 20-35 years, with an identical ethnic and demographic background were examined","Without correcting for multiple testing, HLA-B40 was lower in the group of 85 years and over, as compared to the control group"
4,significant,Finnish,APOC3,APOC3,8018664,The Sst I polymorphism was examined in 179 Finnish centenarians,"The S2 allele (Sst I restriction site present) occurred more often in the centenarians (frequency, 12.9%) than in the youngest reference population (frequency, 8.8%)"
8,significant,Finnish,APOB,APOB,8155090,"The common polymorphism of apolipoprotein E (E2, E3, and E4) was examined in Finnish nonagenarians",The frequency of the E4 allele was lower in the nonagenarians than in the middle-aged and young adults
12,significant,Italian,APOB,APOB,9050915,Allele and genotype frequencies at Hpa1 RFLP were examined in 182 women and 100 men aged >84 years and in 100 boys and 100 girls younger than 17 years,Allele and genotype frequencies were significantly different in the elderly women compared to the younger sample. No difference was observed in the elderly men.
14,significant,English (Cambridge),APOC1,APOC1,9105559,Common polymorphism was examined in 182 women and 100 men aged > 84 years and in 100 boys and 100 girls younger than 17 years,"Difference between genotypes in the elderly women and the young sample was observed. However, this did not retain significance when the genotype frequencies of the young sample were adjusted to values expected from the allele frequencies on the basis of Hardy-Weinberg equilibrium and compared to observed genotypes in elderly men and women."
17,non-significant,Italian,R353Q,F7,9108791,The 677C/T SNP was examined in 182 women and 100 men aged > 84 years and in 100 boys and 100 girls younger than 17 years,MTHFR allele and genotype frequencies were similar in the elderly and young populations
21,non-significant,Spanish,CYP2D6,CYP2D6,9177672,The longevous groups included two independent cohorts totalling 533 centenarians and 163 nonagenarian siblings. Control group included 2950 subjects.,"DR7 frequency was elevated in longevous men and DR13 frequency was increased in centenarians. DR11's influence on longevity displayed a significant interaction with sex, with an increase in women from longevous sibships. HLA-DR homozygotes were more frequent in centenarians than in controls."
22,non-significant,Spanish,CYP2E1,CYP2E1,9177672,"The enzymatic polymorphism was examined in 41 nonagenarians (10 males, mean age 92.2 years, range 90-98) free of known malignancies or neurodegenerative diseases and in control groups comprised of 137 (116 males, mean age 32 years)",No association with longevity was found
23,non-significant,Spanish,NAT2,NAT2,9177672,"The enzymatic polymorphism was examined in 41 nonagenarians (10 males, mean age 92.2 years, range 90-98) free of known malignancies or neurodegenerative diseases and in control groups comprised of 217 healthy volunteers (128 males, mean age 36.3 years)",No association with longevity was found
24,significant,French,HLA-DRB1,HLA-DRB1,9425225,"Glutamine (CAG) to histidine (CAT) substitution at codon 360 was examined in 120 Alzheimer patients (88 females, 32 males) and 119 presumed-healthy elderly subjects (62 females, 57 males)","The frequency of apoAIV alleles was not significantly different between Alzheimer patients and the elderly control group. However, in both groups, apoAIV (360:His) allele frequency was higher than in the general population."
25,non-significant,French,APOA4,APOA4,9533408,The GSTM1 deletion was examined in 552 centenarians and 243 controls aged 20-70 years,No significant difference was found between centenarian and control subjects
27,non-significant,French,GSTM1,GSTM1,9654200,Polymorphic repeats in exon 1 were examined in 196 centenarians (143 females and 53 males) and 358 controls (196 females and 162 male; 10-85 years old),No significant difference in genotypic frequencies was found between centenarians and controls
29,significant,English (Caucasian) and Nigerian,638G/A,SULT1A1,9854023,Polymorphic repeats in intron 7 (Short and Long alleles) were examined in 196 centenarians (143 females and 53 males) and 358 controls (196 females and 162 male; 10-85 years old),No significant difference in genotypic frequencies was found between centenarians and controls
30,non-significant,Italian,PARP1,PARP1,9887369,Polymorphic repeats in intron 1 (Short and Long alleles) were examined in 196 centenarians (143 females and 53 males) and 358 controls (196 females and 162 male; 10-85 years old),A significant loss of LL homozygous genotypes was found at the THO locus in male but not in female centenarians with respect to matched controls
31,non-significant,Italian,REN,REN,9887369,401C/T SNP was examined in 196 centenarians (143 females and 53 males) and 358 controls (196 females and 162 male; 10-85 years old),No significant difference in genotypic frequencies was found between centenarians and controls
32,non-significant,Italian,401C/T,SOD2,9887369,"The 1367 Cys/Arg polymorphism was examined during aging in 175 Finnish centenarians and 178 newborns, 169 Mexican newborns, 23 North American adults and 198 Japanese adults","When newborns and centenarians were compared within the Finnish population no differences were observed in the proportions of 1367 Cys/Arg across age groups. The frequency of the 1367 Arg allele, thought to be protective against myocardial infarction in a Japanese population, was approximately three times higher in the North American and Finnish adult populations."
33,significant,Italian,TH,TH,9887369,C3 alleles were examined in healthy aged people (77 centenarians and 89 elderly subjects),The frequencies of C3 alleles were similar in the studied cohorts
34,non-significant,"Finnish, American, Mexican and Japanese",C1367R,WRN,10069711,Alleles were examined in healthy aged people (77 centenarians and 89 elderly subjects),The frequencies of the alleles were similar in the studied cohorts
35,non-significant,Italian,CFB,CFB,10219002,C4 alleles were examined in healthy aged people (77 centenarians and 89 elderly subjects),"The frequencies of C4A alleles were similar in the studied cohorts. For C4B null allele (C4BQ0) a trend toward an increase in the older cohort was observed, although the differences were not statistically significant after correction for multiple testing."
36,non-significant,Italian,C3,C3,10219002,M/T235 SNP was examined in 187 centenarians and 201 controls (20-64 years),No significant differences relative to longevity were found
37,non-significant,Italian,C4A,C4A,10219002,I/D polymorphism was examined in 187 centenarians and 201 controls (20-64 years),No significant differences relative to longevity were found
39,non-significant,Danish,M/T235,AGT,10494771,"The R353Q substitution, intron 7 (37bp)n, and -323ins10 polymorphisms were examined in 187 centenarians and 201 healthy controls, aged 20-64 years (mean age 42 years).",The genotype frequencies in the centenarians and in the controls were similar
41,non-significant,Danish,R353Q,F7,10494771,L/P33 SNP was examined in 187 Danish centenarians and 201 healthy controls aged 20-64 years (mean age 42 years),No significant association with longevity was found
43,non-significant,Danish,33L/P,ITGB3,10494771,"A/V114 SNP was examined in 187 unselected centenarians, and 201 healthy controls aged 20-64 years (mean age 42 years)",No significant association with longevity was found
44,non-significant,Danish,114A/V,MTHFR,10494771,The 1-bp guanine deletion/insertion (4G/5G) polymorphism was examined in 187 centenarians and 201 healthy controls aged 20-64 years (mean age 42 years),No significant differences relative to longevity were found
45,non-significant,Danish,PLAT,PLAT,10494771,I/D polymorphism was determined in 648 subjects >85 years-old. Genotype distributions in a subset of 356 elderly subjects were compared to 250 young subjects. Mortality of elderly subjects was also followed for 10 years.,The ACE genotype distributions were similar in elderly and young subjects. No associations with mortality were found.
50,non-significant,Italian (Northern),CYP1A1,CYP1A1,11162685,Deletion was examined in 94 nonagenarians and centenarians and 418 control subjects of younger age,A significant difference in the proportion of nonagenarians and centenarians homozygotes for the deletion was observed in comparison to control subjects
51,non-significant,Italian (Northern),GSTM1,GSTM1,11162685,Common polymorphism was examined in 179 persons (28 men and 151 women) aged 100 years and older,"The percentages of E2-allele carriers increased with age, particularly in women. The percentage of carriers of the E4 allele was lower than expected."
52,significant,Italian (Northern),GSTT1,GSTT1,11162685,5'-untranslated region (T-455C) SNP was examined in a group of 137 elderly individuals (70-106 years old),A greater frequency of the -455C allele was demonstrated with aging
53,significant,Russian,T-455C,APOC3,11193221,I/D polymorphism was examined in 560 centenarians and 560 adult controls,No association was observed between ACE allele frequencies or genotype and longevity
59,non-significant,American (Caucasian),G1691A,F5,11568114,"T1565C SNP was examined in 2689 healthy Caucasians aged 17-39 years (n = 979; 505 males and 474 females), 40-59 years (n = 900; 526 males and 374 females), and 60-85 years (n = 810; 530 males and 280 females)",The Pl(A2) allele frequency significantly decreased with age
60,non-significant,American (Caucasian),C807T,ITGA2,11568114,"C677T SNP was examined in 2689 healthy Caucasians aged 17-39 years (n = 979; 505 males and 474 females), 40-59 years (n = 900; 526 males and 374 females), and 60-85 years (n = 810; 530 males and 280 females)",No statistically significant decrease in genotype or allele frequency was observed among carriers of 677T
61,significant,American (Caucasian),T1565C,ITGB3,11568114,"F2 20210 G/A SNP was examined in 2689 healthy Caucasians aged 17-39 years (n = 979; 505 males and 474 females), 40-59 years (n = 900; 526 males and 374 females), and 60-85 years (n = 810; 530 males and 280 females)",No statistically significant decrease in genotype or allele frequency was observed among carriers of F2
66,significant,Danish,M/T235,AGT,11602206,Polymorphisms were examined in 187 centenarians (47 males and 140 females) and 201 controls (20-64 years),No association with longevity was found
68,non-significant,Danish,F7,F7,11602206,"Common polymorphism (E2, E3, and E4) was studied in 164 subjects including 35 persons aged 90 years or older, 71 men aged 20-35 and 54 men with myocardial infarction",There was a statistically significant difference in the E4 allele frequencies among the three groups with the older group showing a lower E4 allele frequency
71,non-significant,Finnish,IL10,IL10,11640949,250 (52 males and 198 females) nonagenarians and 400 healthy control group (18-60 years old) were examined for -889 SNP,No significant differences relative to longevity were found
72,non-significant,Finnish,-889C/T,IL1A,11640949,250 (52 males and 198 females) nonagenarians and 400 healthy control (18-60 years old) were examined for VNTR polymorphism in intron 2 (an 86 bp repeat sequence),No significant differences relative to longevity were found
73,non-significant,Finnish,IL1B,IL1B,11640949,"Exon 9 AvaII RFLP polymorphism was examined in 219 centenarians (72 males and 147 females) and 256 (controls 20-70 years, 119 males and 137 females)",No significant difference between centenarians and controls was observed
74,non-significant,Finnish,IL1RN,IL1RN,11640949,"250 (52 males and 198 females) nonagenarians and 400 healthy control group (18-60 years old) were examined for -174, +3953 and -511 SNPs",No significant differences relative to longevity were found
75,non-significant,Finnish,IL6,IL6,11640949,250 (52 males and 198 females) nonagenarians and 400 healthy control group (18-60 years old) were examined for -308 SNP,No significant differences relative to longevity were found
77,non-significant,Italian,IGF2,IGF2,11672987,Polymorphisms were examined in 102 centenarians from the New England area and 84 centenarians from Italy. The control population consisted of 97 individuals from Italy.,The genotype a+a was more frequent in both centenarian groups compared to the control group whereas the genotype a+b was less frequent. The results however were not statistically significant.
78,non-significant,Italian,FokI RFLP,INS,11672987,"I/D polymorphism was examined in 424 subjects comprising 227 Uighur individuals, 108 Kazakh individuals, and 89 Han individuals. All subjects in the latter two groups ranged in age from 65 to 70 years, whereas the Uighur subjects comprised two different age groups: those ranging in age from 59 to 70 years and those ranging in age from 90 to 113 years.","Within the Uighur group, frequency of the D allele was significantly higher in the group aged >90 than in the group aged <70. The overall distributions of alleles in the three groups did not differ significantly."
80,non-significant,American (Caucasians) and Italian,BRCA1,BRCA1,11795532,"The -1082G/A, -819C/T and -592C/A proximal promoter SNPs were examined in 190 centenarians (>99 years old, 159 women and 31 men) and in 260 control subjects (99 women and 161 men less than 60 years old)","The -1082G homozygous genotype, associated with high IL-10 production, was increased in centenarian men but not in centenarian women. No difference was found between centenarians and control subjects regarding the other two SNPs."
83,significant,Italian (Sicily),C282Y,HFE,11857058,The -124 and 169 position SNPs were examined in 50 centenarians and 86 young controls,Genotype and allele distribution for both polymorphisms were similar in controls and centenarians
84,non-significant,Italian (Northern),FAS,FAS,11965496,"A Leucine (L allele) to Methionine (M allele) substitution at codon 55, and a Glutamine (A allele) to Arginine (B allele) substitution at codon 192 were examined in 579 people aged 20 to 65 years old, and in 308 centenarians","Significant differences between young people and centenarians were observed. The percentage of carriers of the B allele at codon 192 is higher in centenarians than in controls (0.539 vs 0.447), though this was due to an increase of people carrying M alleles at codon 55."
85,non-significant,Italian (Northern),FASLG,FASLG,11965496,I/D polymorphism was examined in 101 long-lived subjects and in a group of 494 younger persons,No connection was found between ACE polymorphism and long-life
89,significant,Italian,TH,TH,12297342,"APOC3-SstI-RFLP polymorphism was examined in a healthy population of 304 subjects aged 18-45 years, 267 subjects aged 46-80 years and 229 subjects aged 81-109 years (including 184 subjects, 43 males and 141 females, older than 100 years)",No significant differences relative to longevity were found
90,non-significant,Chinese,5178A,ND2,12384792,The cognitive skills of 684 twins aged 73+ years were examined in relation to a polymorphic 287 bp fragment in the ACE gene that can be present in the insertion (I) variant and absent in the deletion (D) variant,"Neither physical nor cognitive performance was associated with the ACE genotype. Having the D allele, however, improved the chances of survival."
92,non-significant,Italian (Southern),APOC3-SstI-RFLP,APOC3,12556235,"APOA4-HincII-RFLP (Asp127/Ser127) polymorphism was examined in a healthy population with 304 subjects aged 18-45 years, 267 subjects aged 46-80 years and 229 subjects aged 81-109 years (including 184 subjects, 43 males and 141 females, older than 100 years)",No significant differences relative to longevity were found
93,significant,Italian (Southern),APOA1-MspI-RFLP,APOA1,12556235,"A (GT)n repeat polymorphism in the promoter region of the human HO-1 gene was examined in younger (60 years, 59 male and 45 female) and older (60-75 years, 95 male and 106 female) subjects","The proportion of allelic frequencies in class L with a large size of (GT)n repeat, as well as the genotypic frequencies in group I with class L alleles, was significantly lower in the oldest male subjects than in the younger males. In contrast, in the oldest female subjects this was not observed."
94,non-significant,Italian (Southern),APOA4-HincII-RFLP,APOA4,12556235,The R219K SNP was examined in 256 centenarians and 190 healthy younger controls (22-65 years old),The allelic frequencies were not different between the two groups
95,significant,Japanese,(GT)n repeat,HMOX1,12566526,"Polymorphisms (mutations in intron 14 and exon 15, and Taq1B) were examined in 256 centenarians and 190 healthy younger controls (22-65 years old)",The allelic frequencies did not differ between the two groups
96,non-significant,Japanese,R219K,ABCA1,12601526,C-514T SNP was examined in 256 centenarians and 190 healthy younger controls (22-65 years old),The allelic frequencies were not different between the two groups
97,non-significant,Japanese,CETP,CETP,12601526,PvuII and HindIII polymorphisms were examined in 256 centenarians and 190 healthy younger controls (22-65 years old),The allelic frequencies were not different between the two groups
98,non-significant,Japanese,C-514T,LIPC,12601526,I/D polymorphism was examined in 103 centenarians (13 men and 90 women) and in 7232 apparently healthy adults (4100 men and 3132 women),The frequencies of genotypes and alleles of the centenarians were not significantly different from those of the control groups. There was also a lack of association between the presence of the D allele and dementia status.
99,non-significant,Japanese,LPL,LPL,12601526,"Common polymorphism was examined in 103 centenarians (13 men and 90 women, mean age 102.4 +/- 2.6 years) and in 6435 adults (5008 men and 1427 women) of mean age 50.7 +/- 7.9 years","The frequencies of genotypes and alleles of the centenarians were not significantly different from those of the control groups. The frequency of the E4 allele, however, was significantly higher in centenarians with dementia than in centenarians without definitive dementia."
102,significant,American (Caucasian),AKAP10,AKAP10,12646697,"Promoter -308 G/A SNP was examined in 72 centenarian men, 102 centenarian women and healthy unrelated controls (115 men and 112 women, aged 22-60 years)","The genotypic frequencies 308G and 308A, suggested to be associated with low and high TNF alpha production respectively, were not significantly different between centenarians and controls"
105,non-significant,Italian (Northern and Central),-511C/T,IL1B,12714264,"The -889 C/T SNP was examined in 1131 unrelated individuals aged 20-102 years (453 females and 678 males, including 94 female and 40 male centenarians)","No significant differences in the genotype and allele frequency distributions were observed between young, elderly and centenarian subjects"
106,non-significant,Italian (Northern and Central),IL1RN,IL1RN,12714264,"The frequency of the T2437C transversion (Met to Thr) polymorphism was investigated in a healthy aged population of 100 control samples (59% female, 41% male with an age-range of 19-45 years) and 129 aged consecutive samples (70% female, 30% male with an age range of 80-97 years)","The 2437T polymorphic nucleotide was observed to increase in the elderly, although not attaining statistical significance. The TT genotype was observed to be significantly increased within the aged population, while conversely the TC genotype was significantly decreased in the aged subjects."
107,non-significant,Italian (Nothern and Central),-889C/T,IL1A,12714264,"100 and 93 octogenarian and nonagenarian subjects + 182 control subjects (41% male, 59% female) were examined for -174 polymorphism","The frequency of GG homozygotes decreases with age by about 10% compared with young controls, though this is borderline significant. CC homozygotes have higher serum levels of IL-6 levels compared with GG."
109,significant,Irish,T2437C,HSPA1L,12714268,"100 control samples (59% female and 41% male) and 93 aged consecutive samples (70% female, 30% male with an age range of 80-97 years) were analyzed for -1082G/A SNP",No significant differences were observed in centenarians and controls
110,non-significant,Irish,IFNG,IFNG,12714268,"100 control samples (59% female and 41% male) and 93 aged consecutive samples (70% female, 30% male with an age range of 80-97 years) were analyzed for Exon 8 A/T SNP",No significant differences were observed in centenarians and controls
112,non-significant,Irish,IL12A,IL12A,12714268,"100 control samples (59% female and 41% male) and 93 aged consecutive samples (70% female, 30% male with an age range of 80-97 years) were analyzed for -174G/C SNP",No significant difference between centenarians and controls was observed
